speaker,transcript
Phoebe Buffay,"Wait, does he eat chalk?"
Phoebe Buffay,"Just, 'cause, I don't want her to go through what I went through with Carl- oh!"
Phoebe Buffay,No.
Phoebe Buffay,Ooh! Oh!
Phoebe Buffay,Fine! Be murky!
Phoebe Buffay,"If I let go of my hair, my head will fall off."
Phoebe Buffay,"Raindrops on roses and rabbits and kittens, bluebells and sleighbells and- something with mittens... La la la la...something and noodles with string. These are a few..."
Phoebe Buffay,I helped!
Phoebe Buffay,"What does that mean? Does he sell it, drink it, or just complain a lot?"
Phoebe Buffay,"Ooh, I just pulled out four eyelashes. That can't be good."
Phoebe Buffay,"Oh, I wish I could, but I don't want to."
Phoebe Buffay,"Love is sweet as summer showers, love is a wondrous work of art, but your love oh your love, your love...is like a giant pigeon...crapping on my heart. La-la-la-la-la- Thank you. La-la-la-la...ohhh!"
Phoebe Buffay,"Oh no, don't hate, you don't want to put that out into the universe."
Phoebe Buffay,"All right, c'mere, gimme your feet."
Phoebe Buffay,"Give her a break, it's hard being on your own for the first time."
Phoebe Buffay,"You're welcome. I remember when I first came to this city. I was fourteen. My mom had just killed herself and my step-dad was back in prison, and I got here, and I didn't know anybody. And I ended up living with this albino guy who was, like, cleaning windshields outside port authority, and then he killed himself, and then I found aromatherapy. So believe me, I know exactly how you feel."
Phoebe Buffay,I can't believe what I'm hearing here...
Phoebe Buffay,What I said you had...
Phoebe Buffay,"Oh, was I doing it again?"
Phoebe Buffay,"Oh, yeah!"
Phoebe Buffay,...Then I've already seen this one!
Phoebe Buffay,"She's already fluffed that pillow... Monica, you know, you've already fluffed that- -but, it's fine!"
Phoebe Buffay,"Monica- Hi! Um, Monica, you're scaring me. I mean, you're like, you're like all chaotic and twirly. And not-not in a good way."
Phoebe Buffay,"Yeah, it's beautiful."
Phoebe Buffay,"No, look, don't touch that!"
Phoebe Buffay,Doy! Probably right before she lost it!
Phoebe Buffay,Ooh! I found it!
Phoebe Buffay,She is so great! I miss her.
Phoebe Buffay,"Y'know, it's even worse when you're twins."
Phoebe Buffay,"Yeah. We don't speak. She's like this high-powered, driven career type."
Phoebe Buffay,She's a waitress.
Phoebe Buffay,"You know, if you tilt your head to the left, and relax your eyes, it kinda looks like an old potato."
Phoebe Buffay,Okay!
Phoebe Buffay,Hi guys!
Phoebe Buffay,"Um, not so good. He walked me to the subway and said 'We should do this again!'"
Phoebe Buffay,"Or, or, y'know, um, 'I think we should see other people' means 'Ha, ha, I already am'."
Phoebe Buffay,"Yeah- no- I'm just- it's, I haven't worked- It's my bank."
Phoebe Buffay,"It's nothing, it's just- Okay. I'm going through my mail, and I open up their monthly, you know, STATEMENT-"
Phoebe Buffay,- and there's five hundred extra dollars in my account.
Phoebe Buffay,"Yes, 'cause now I have to go down there, and deal with them."
Phoebe Buffay,"It's not mine, I didn't earn it, if I kept it, it would be like stealing."
Phoebe Buffay,"Okay. Okay, let's say I bought a really great pair of shoes. Do you know what I'd hear, with every step I took? 'Not-mine. Not-mine. Not-mine.' And even if I was happy, okay, and, and skipping- 'Not-not-mine, not-not-mine, not-not-mine, not-not-mine'..."
Phoebe Buffay,Okay. I'd- just- I'd never be able to enjoy it. It would be like this giant karmic debt.
Phoebe Buffay,"Oh, I can't believe you! You've been so good, for three years!"
Phoebe Buffay,"Oh, no! I- I can't drink this now!"
Phoebe Buffay,"'Dear Ms. Buffay. Thank you for calling attention to our error. We have credited your account with five hundred dollars. We're sorry for the inconvenience, and hope you'll accept this- -football phone as our free gift.' Do you believe this?! Now I have a thousand dollars, and a football phone!"
Phoebe Buffay,"Yes, yes! Like the man in the shoe!"
Phoebe Buffay,"From the nursery rhyme. 'There was a crooked man, Who had a crooked smile, Who lived in a shoe, For a... while...'"
Phoebe Buffay,"Hey, Lizzie."
Phoebe Buffay,I brought you alphabet soup.
Phoebe Buffay,"Yes. But I left in the Ys. 'Cause, y'know, ""sometimes y"". Uh, I also have something else for you."
Phoebe Buffay,"No, but would you like a thousand dollars and a football phone?"
Phoebe Buffay,I know.
Phoebe Buffay,"No, I want you to have it. I don't want it."
Phoebe Buffay,"Oh, that's fine, no."
Phoebe Buffay,"No. 'Cause you need that. No, it's okay, thanks."
Phoebe Buffay,"Okay, alright, you buy me a soda, and then we're even. Okay?"
Phoebe Buffay,Okay.
Phoebe Buffay,"No, I'm fine."
Phoebe Buffay,Huh!
Phoebe Buffay,"I know! I know, I opened it up and there it was, just floating in there, like this tiny little hitch-hiker!"
Phoebe Buffay,"Does, um, anyone wanna see?"
Phoebe Buffay,"Yeah, 'cause otherwise someone might get what they actually ordered."
Phoebe Buffay,Does anyone want the rest of this Pop-Tart?
Phoebe Buffay,"Sorry. ..Y'know, those stupid soda people gave me seven thousand dollars for the thumb."
Phoebe Buffay,"And on my way over here, I stepped in gum. ...What is up with the universe?!"
Phoebe Buffay,"Wait, wait, I'm getting a deja vu...no, I'm not."
Phoebe Buffay,There it is!
Phoebe Buffay,"You know.. you let your guard down, you start to really care about someone, and I just- I-"
Phoebe Buffay,Did he mention us?
Phoebe Buffay,If you never smoke again I'll give you seven thousand dollars!
Phoebe Buffay,"Okay, okay. If I were omnipotent for a day, I would want, um, world peace, no more hunger, good things for the rain-forest...And bigger boobs!"
Phoebe Buffay,Oh! What what what! ...Hi.
Phoebe Buffay,I got no sleep last night!
Phoebe Buffay,"My grandmother has this new boyfriend, and they're both kind of insecure in bed. Oh, and deaf. So they're constantly, like, having to reassure each other that they're having a good time. You have no idea how loud they are!"
Phoebe Buffay,Thanks.
Phoebe Buffay,"I remember the day I got my first pay check. There was a cave in in one of the mines, and eight people were killed."
Phoebe Buffay,"I worked in a Dairy Queen, why?"
Phoebe Buffay,"Look, look, I have elbows!"
Phoebe Buffay,"Ooh! Ooh! And I brought Operation! But, um, I lost the tweezers, so we can't operate. But we can prep the guy!"
Phoebe Buffay,You are just like Jack.
Phoebe Buffay,"No, Jack and the Beanstalk."
Phoebe Buffay,"Yeah, right! See, he gave up something, but then he got those magic beans. And then he woke up, and there was this, this big plant outside his window, full of possibilities and stuff.. And he lived in a village, and you live in the Village.."
Phoebe Buffay,"Oh, see, Jack did love the cow."
Phoebe Buffay,Floopy?
Phoebe Buffay,"Oh, like that's a word."
Phoebe Buffay,"Oh, well... 'cause.... you just... I don't like this question."
Phoebe Buffay,What?
Phoebe Buffay,I don't even have a 'pl'.
Phoebe Buffay,And-and a power tie?
Phoebe Buffay,Big Bird's friend.
Phoebe Buffay,"Oh, I wanna see! Lemme see! Lemme see!"
Phoebe Buffay,"Ooh, wait.. wait, I see a woman."
Phoebe Buffay,Definitely not his mother.
Phoebe Buffay,"Oh, wait, she's walking across the floor.. she's walking.. she's walking.. she's going for the pizza- Hey, that's not for you, bitch!"
Phoebe Buffay,Yeah?
Phoebe Buffay,Uh-huh.
Phoebe Buffay,"Oh! Oh! Oh! Okay, fine, fine. Now I don't feel so bad about sleeping with Jason Hurley."
Phoebe Buffay,You'd already broken up.
Phoebe Buffay,A couple hours.
Phoebe Buffay,There he is! There he is!
Phoebe Buffay,Right- where we've been looking all night!
Phoebe Buffay,"Oh, ok, you know what I don't get? The way guys can do so many mean things, and then not even care."
Phoebe Buffay,"You know, if you want, I'll do it with you."
Phoebe Buffay,"No, I mean you break up with Janice and I'll break up with Tony."
Phoebe Buffay,"Yeah, I know, he's sweet, but it's just not fun anymore, you know? I don't know if it's me, or his hunger strike, or, I don't know."
Phoebe Buffay,What's the matter? Why so scrunchy?
Phoebe Buffay,"Uh-huh, uh-huh."
Phoebe Buffay,Are you gonna go over there?
Phoebe Buffay,This is nice. We never do anything just the two of us.
Phoebe Buffay,"Eww, I don't wanna do that."
Phoebe Buffay,"Ok, have a good break-up."
Phoebe Buffay,"Yeah, it was really hard."
Phoebe Buffay,"Ok, you weren't there."
Phoebe Buffay,"Ok, you can do this. It's just like pulling off a Band-aid. Just do it really fast, and then the wound is exposed."
Phoebe Buffay,Oh my god. How many of those have you had?
Phoebe Buffay,"Chandler, easy, easy. Go to your happy place. La la la la la la la."
Phoebe Buffay,All right.
Phoebe Buffay,Wait here. Breathe.
Phoebe Buffay,It's like a gift.
Phoebe Buffay,"Oh, I'd like that."
Phoebe Buffay,What a neat idea. All your clothes match. I'm gonna do this.
Phoebe Buffay,"Hey, how'd it go?"
Phoebe Buffay,"Oh, he needed some time to grieve."
Phoebe Buffay,That oughta do it.
Phoebe Buffay,"The exclamation point in the title scares me. Y'know, it's not just Freud, it's Freud!"
Phoebe Buffay,"Oh, oh, but y'know, you always see these really beautiful women with these really nothing guys, you could be one of those guys."
Phoebe Buffay,Based on this play? ...Based on this play!
Phoebe Buffay,"No, 'cause this line is passion, and this is... just a line."
Phoebe Buffay,"Oh, yeah. That is not true. Ross, is this your fantasy?"
Phoebe Buffay,I can't believe you tried to move the green ottoman.
Phoebe Buffay,"Yeah, you are, Monica. Remember when I lived with you? You were like, a little, y'know, Ree! Ree! Ree! Ree!"
Phoebe Buffay,Ree! Ree! Ree! Ree! Ree!
Phoebe Buffay,"Seriously, what-what's the part?"
Phoebe Buffay,"No, I don't think this was your shot. I mean, I don't even think you just get one shot. I really believe big things are gonna happen for you, I do! You've gotta just keep thinking about the day that some kid is gonna run up to his friends and go 'I got the part! I got the part! I'm gonna be Joey Tribbiani's ass!'."
Phoebe Buffay,"Hi. Um, I want to start with a song thats about that moment when you suddenly realize what life is all about. OK, here we go. OK, thank you very much."
Phoebe Buffay,Can I borrow the phone? I want to call my apartment and check on my grandma. What's my number?
Phoebe Buffay,"Well, I never call me."
Phoebe Buffay,"Eww, look. Ugly Naked Guy lit a bunch of candles."
Phoebe Buffay,Oh... Milwaukee.
Phoebe Buffay,"Oh, Rachel."
Phoebe Buffay,"New York City has no power, and the milk is getting sour. But to me it is not scary, 'cause I stay away from dairy.... la la la, la la, la la..."
Phoebe Buffay,About what?
Phoebe Buffay,What surprise party?
Phoebe Buffay,"Well, he didn't tell me."
Phoebe Buffay,This is so typical. I'm always the last one to know everything.
Phoebe Buffay,Yuh-huh! I was the last one to know when Chandler got bitten by the peacock at the zoo. I was the last one to know when you had a crush on Joey when he was moving in. Looks like I was second to last.
Phoebe Buffay,"Oh, poor little Tooty is scared to death. We should find his owner."
Phoebe Buffay,"Oh no, the Mendels, they hate all living things, right?"
Phoebe Buffay,He seems to hate you. Are you sure?
Phoebe Buffay,Wait a minute. What's his name?
Phoebe Buffay,Oooh! You are a very bad man!
Phoebe Buffay,Alright. I looked all over the building and I couldn't find the kitty anywhere.
Phoebe Buffay,Ah! Well! There you go! Last to know again! And I'm guessing... since nobody told me... this is Paolo.
Phoebe Buffay,You betcha!
Phoebe Buffay,"I know, I just want to bite his bottom lip. But I won't."
Phoebe Buffay,"You know, did you ride mopeds? 'Cause I've heard... ... oh, I see... it's not about that right now. OK."
Phoebe Buffay,"Oh, look look look. The last candle's about to burn out. 10, 9, 8, 7... ... negative 46, negative 47, negative 48...."
Phoebe Buffay,Thanks.
Phoebe Buffay,"Yeah, I think so, yeah."
Phoebe Buffay,"I dunno, 'cause you're smart, you're funny..."
Phoebe Buffay,"Yeah, you have homosexual hair."
Phoebe Buffay,"Oh, that sucks!"
Phoebe Buffay,Maybe that's 'cause she's not really gone.
Phoebe Buffay,"Hm, I mean maybe no-one ever really goes. Ever since my mom died, every now and then, I get the feeling that she's like right here, y'know? Oh! And Debbie, my best friend from junior high- got struck by lightning on a miniature golf course- I always get this really strong Debbie vibe whenever I use one of those little yellow pencils, y'know? ...I miss her."
Phoebe Buffay,Thanks!
Phoebe Buffay,"Y'know, I dunno who this is, but it's not Debbie."
Phoebe Buffay,"Hi, sorry I'm late, I couldn't find my bearings."
Phoebe Buffay,What'd I say?
Phoebe Buffay,"God, what a great day. ...What? Weather-wise!"
Phoebe Buffay,"Okay, don't worry, I'm just checking to see if the muscle's in spasm...huh."
Phoebe Buffay,You missed a belt loop.
Phoebe Buffay,"Okay, it's in spasm."
Phoebe Buffay,"Hey, look who's up! How do you feel?"
Phoebe Buffay,Ooh! That's so nice...
Phoebe Buffay,Hey.
Phoebe Buffay,What were you modeling for?
Phoebe Buffay,"You know, the asthma guy was really cute."
Phoebe Buffay,"Yes, and her boyfriend. But we're celebrating Thanksgiving in December 'cause he is lunar."
Phoebe Buffay,"Yeah. Oh, can I come?"
Phoebe Buffay,"Ooh, ooh! Why don't we invite her?"
Phoebe Buffay,"Oh, I believe it. I think the baby can totally hear everything. I can show you. Look, this will seem a little weird, but you put your head inside this turkey, and then we'll all talk, and you'll hear everything we say."
Phoebe Buffay,"No, we were just laughing. You know, how laughter can be infectious."
Phoebe Buffay,"Look out, incoming pumpkin pie!"
Phoebe Buffay,"Ok, all done."
Phoebe Buffay,"Oh, I'm sorry, oh, I just, I thought we could have them whipped and then add some peas and onions."
Phoebe Buffay,"Well, 'cause then they'd be like my mom used to make them, you know, before she died."
Phoebe Buffay,Almost never.
Phoebe Buffay,"Yeah, but did they have to shoot him down? I mean, that was just mean."
Phoebe Buffay,"Ooh, ok, that's it. Enough with the keys. No one say keys."
Phoebe Buffay,Ooh.
Phoebe Buffay,Ugly Naked Guy's taking his turkey out of the oven. Oh my god. He's not alone. Ugly Naked Guy's having Thanksgiving dinner with Ugly Naked Gal.
Phoebe Buffay,It's nice that he has someone.
Phoebe Buffay,"Ooh, you guys have to make a wish."
Phoebe Buffay,"Come on, you know, Thanksgiving. Ooh, you got the bigger half. What'd you wish for?"
Phoebe Buffay,That is so cruel! Why? Why would a parent name their child Bethel?
Phoebe Buffay,"So you guys, I'm doing all new material tonight. I have twelve new songs about my mother's suicide, and one about a snowman."
Phoebe Buffay,"Yeah, you wish!"
Phoebe Buffay,"Oh, oh, good."
Phoebe Buffay,"Thanks, hi. Um, I wanna start with a song that means a lot to me this time of year."
Phoebe Buffay,"I made a man with eyes of coal And a smile so bewitchin', How was I supposed to know That my mom was dead in the kitchen? La lalala la la la la lalala la la..."
Phoebe Buffay,
Phoebe Buffay,"...My mother's ashes Even her eyelashes Are resting in a little yellow jar, And sometimes when it's breezy..."
Phoebe Buffay,
Phoebe Buffay,...I feel a little sneezy And now I-
Phoebe Buffay,"Excuse me, excuse me! Yeah, noisy boys! Is it something that you would like to share with the entire group?"
Phoebe Buffay,"Well, c'mon, if it's important enough to discuss while I'm playing, then I assume it's important enough for everyone else to hear!"
Phoebe Buffay,Could you speak up please?
Phoebe Buffay,"Okay, we're gonna take a short break."
Phoebe Buffay,"David's like, y'know, Scientist Guy. He's very methodical."
Phoebe Buffay,Me too! Oh! Did you ever see An Officer and a Gentleman?
Phoebe Buffay,"Well, he's kinda like the guy I went to see that with. Except, except he-he's smarter, and gentler, and sweeter... I just- I just wanna be with him all the time. Day and night, and night and day... and special occasions..."
Phoebe Buffay,"No, no, no, no, no, no. Yeah, could I just?"
Phoebe Buffay,"Okay, alright, I have a question, then."
Phoebe Buffay,"Um, were you planning on kissing me ever?"
Phoebe Buffay,Sure.
Phoebe Buffay,"Oh, David, I, I think you are a sweeping sorta fella. I mean, you're a sweeper! ...trapped inside a physicist's body."
Phoebe Buffay,"Oh, yeah, oh, I'm sure of it. You should just do it, just sweep and throw me."
Phoebe Buffay,"Oh yeah, right now."
Phoebe Buffay,"Okay, now you're just kinda tidying."
Phoebe Buffay,I can hop.
Phoebe Buffay,"Oh, hi Max! Hey, do you know everybody?"
Phoebe Buffay,"No, no, he hasn't been around."
Phoebe Buffay,Minsk?
Phoebe Buffay,I know where Minsk is.
Phoebe Buffay,"So when, when do you leave?"
Phoebe Buffay,Hello?
Phoebe Buffay,Hi.
Phoebe Buffay,"Um, well, Max told me about Minsk, so congratulations! This is so exciting!"
Phoebe Buffay,"Oh, you're not going? Oh, why?"
Phoebe Buffay,So-so you're really not going?
Phoebe Buffay,Oh don't do that.
Phoebe Buffay,Oh no no.
Phoebe Buffay,"Oh, but I can't do that-"
Phoebe Buffay,"It's your thing, and-"
Phoebe Buffay,"Okay, um, stay."
Phoebe Buffay,Stay.
Phoebe Buffay,Getting so good at that!
Phoebe Buffay,And then... your face is bloated?
Phoebe Buffay,"Hi, Max!"
Phoebe Buffay,Are you alright?
Phoebe Buffay,You're going to Minsk.
Phoebe Buffay,"Oh, you are so going to Minsk. You belong in Minsk. You can't stay here just 'cause of me."
Phoebe Buffay,"Oh yes, yes, yes you can. Just say, um, 'Phoebe, my work is my life and that's what I have to do right now'. And I say 'your work?! Your work?! How can you say that?!'. And then you say, um, 'it's tearing me apart, but I have no choice. Can't you understand that?'. And I say 'no! No! I can't understand that!'."
Phoebe Buffay,"Ooh, sorry. Um, and, and then you put your arms around me. And then you put your arms around me. And, um, and then you tell me that you love me and you'll never forget me."
Phoebe Buffay,And then you say that it's almost midnight and you have to go because you don't wanna start the new year with me if you can't finish it. I'm gonna miss you. You scientist guy.
Phoebe Buffay,Everybody looks so happy. I hate that.
Phoebe Buffay,I dunno. I don't feel like kissing anyone tonight.
Phoebe Buffay,Do you think they have yesterday's daily news?
Phoebe Buffay,"Just wanna check my horoscope, see if it was right."
Phoebe Buffay,"Where? Ooh, come to Momma."
Phoebe Buffay,We should do something. Whistle.
Phoebe Buffay,"Come on, do it."
Phoebe Buffay,Do it!
Phoebe Buffay,Do it do it do it!
Phoebe Buffay,I can't believe you did that!
Phoebe Buffay,"I just wish there was something we could do. Hello. Hello, Coma Guy. GET UP, YOU GIRL SCOUT! UP! UP! UP!"
Phoebe Buffay,Maybe nobody's tried this.
Phoebe Buffay,"Yeah, but did you see the dents in his knuckles? That means he's artistic."
Phoebe Buffay,"Oh! And, he's the kinda guy who, when you're talking, he's listening, y'know, and not saying 'Yeah, I understand' but really wondering what you look like naked."
Phoebe Buffay,I know.
Phoebe Buffay,"Yeah, we-we feel kinda responsible."
Phoebe Buffay,Hey hey hey! She's on!
Phoebe Buffay,Your mom was arrested?
Phoebe Buffay,What about Glen? He could be a Glen.
Phoebe Buffay,Ooh! How about Agamemnon?
Phoebe Buffay,I'm in.
Phoebe Buffay,Hi.
Phoebe Buffay,"Nothing, I just thought I'd stop by.. y'know, after the uh... that I.. y'know, so what are you doing here?"
Phoebe Buffay,"No. No! No! ...So, um, do you think he's doing any better than he was this morning?"
Phoebe Buffay,"Really? Not even to, um, change his PAJAMAS?!"
Phoebe Buffay,Hey Rach.
Phoebe Buffay,Hello.
Phoebe Buffay,Going to the hospital tonight?
Phoebe Buffay,"No, you?"
Phoebe Buffay,"Okay, maybe it was a trick question. Um, Rachel can we do this now?"
Phoebe Buffay,"Thanks. Hi, um, 'kay. I'd like to start with a song that's about a man that I recently met, who's, um, come to be very important to me. 'Kay."
Phoebe Buffay,"You don't have to be awake to be my man, As long as you have brainwaves I'll be there to hold your hand. Though we just met the other day, There's something I have got to say..."
Phoebe Buffay,"Okay, thank you very much, I'm gonna take a short break!"
Phoebe Buffay,"Alright, whadyou do with him?"
Phoebe Buffay,"Look at you! How, how do you feel?"
Phoebe Buffay,I'm Phoebe Buffay.
Phoebe Buffay,"Well, we both have."
Phoebe Buffay,"Well, actually it's just from me."
Phoebe Buffay,You know who shaved you? That was me.
Phoebe Buffay,I sang. Hah!
Phoebe Buffay,You're welcome.
Phoebe Buffay,"What, that's it?"
Phoebe Buffay,I don't think you mean that.
Phoebe Buffay,Y'know what? We thought you were different. But I guess it was just the coma.
Phoebe Buffay,"Ooh, this is cool...it says in some parts of the world, people actually eat the placenta."
Phoebe Buffay,Sorry.
Phoebe Buffay,"Woo-hoo, first weekend away together!"
Phoebe Buffay,"Ok, thanks."
Phoebe Buffay,"Oh, Paolo, hi, what are you doing here?"
Phoebe Buffay,"Well, Racquela's right, yeah!"
Phoebe Buffay,"Oh, okay, I don't know what you just said, so let's get started."
Phoebe Buffay,"Um, that's really your decision, I mean, some people prefer, you know, to take off...oh whoops! You're being naked!"
Phoebe Buffay,Fine!
Phoebe Buffay,"Nothing, I'm sorry, I'm just, I'm out of sorts."
Phoebe Buffay,"All right, you know Paolo?"
Phoebe Buffay,"Well, he made a move on me."
Phoebe Buffay,"Well, he came in for a massage, and everything was fine until."
Phoebe Buffay,"Oh yeah, I'm sure. And all of a sudden his hands weren't the problem anymore."
Phoebe Buffay,"Oh, boy scouts could have camped under there."
Phoebe Buffay,Uma Thurman.
Phoebe Buffay,She is gonna hate me.
Phoebe Buffay,Hey!
Phoebe Buffay,Are you moving out?
Phoebe Buffay,"Um, um, Rachel can we talk for a sec?"
Phoebe Buffay,"Oh! Ok, um, ok, um,"
Phoebe Buffay,"Ok, um, we haven't known each other for that long a time, and, um, there are three things that you should know about me. One, my friends are the most important thing in my life, two, I never lie, and three, I make the best oatmeal raisin cookies in the world."
Phoebe Buffay,"Oh, I don't make them a lot because I don't think it's fair to the other cookies"
Phoebe Buffay,Which proves that I never lie.
Phoebe Buffay,Paolo made a pass at me.
Phoebe Buffay,Are you okay?
Phoebe Buffay,"Ok, I've got milk Here you go... Oh! Better?"
Phoebe Buffay,"I'm so embarrassed, I'm the one he hit on!"
Phoebe Buffay,I'm so sorry! No I'm sorry! No I'm sorry! No I'm sorry!
Phoebe Buffay,"No, wait, oh, what are we sorry about?"
Phoebe Buffay,Such a pig!
Phoebe Buffay,Oh he's like a...
Phoebe Buffay,...like a...
Phoebe Buffay,"Yes, good! Ok..."
Phoebe Buffay,"Oh! I know! It's because... he's gorgeous, and he's charming, and when he looks at you..."
Phoebe Buffay,The end.
Phoebe Buffay,Should I not have told you?
Phoebe Buffay,"I think she took it pretty well. You know Paolo's over there right now, so..."
Phoebe Buffay,Ooh!
Phoebe Buffay,"Oh, ok bye-bye."
Phoebe Buffay,"Oh, just look at her..."
Phoebe Buffay,You ok?
Phoebe Buffay,Yep!
Phoebe Buffay,"Yes, you're having a boy!"
Phoebe Buffay,"Oh, honey, honey, tell them the story about your patient who thinks things are, like, other things. Y'know? Like, the phone rings and she takes a shower."
Phoebe Buffay,Oops!
Phoebe Buffay,"Thanks. Okay, now go away so we can talk about you."
Phoebe Buffay,Isn't he great?
Phoebe Buffay,"I know, I know. So sweet... and so complicated. And for a shrink, he's not too shrinky, y'know?"
Phoebe Buffay,"Oh, I don't know, I don't know. I think that's a little weird, y'know? Vinyl."
Phoebe Buffay,"Yeah, 'cause hello, these are not her boobies, these are her breasts."
Phoebe Buffay,"Oh, this is my friend Roger."
Phoebe Buffay,It's Phoebe.
Phoebe Buffay,Isn't he good?
Phoebe Buffay,"Oh, okay. Feel better, Rachel, 'kay?"
Phoebe Buffay,"Oh, okay. Listen, thanks for everything, Mon."
Phoebe Buffay,Hey.
Phoebe Buffay,Good. Oh oh! Roger's having a dinner thing and he wanted me to invite you guys.
Phoebe Buffay,So what's going on?
Phoebe Buffay,"Uh-huh. Okay. Okay, don't you think, maybe, though, it's just that he's so perceptive that it freaks you out?"
Phoebe Buffay,"Nothing, nothing."
Phoebe Buffay,"It's, I mean, it's nothing, I'm fine. It's my friends. They-they have a liking problem with you. In that, um, they don't."
Phoebe Buffay,But they don't see all the wonderfulness that I see. They don't see all the good stuff and all the sweet stuff. They just think you're a little...
Phoebe Buffay,Intense and creepy.
Phoebe Buffay,"But I don't. Me, Phoebe."
Phoebe Buffay,"You're not? See, that's why you're so great!"
Phoebe Buffay,Hey.
Phoebe Buffay,"Oh, okay, except I broke up with Roger."
Phoebe Buffay,"Yeah, right."
Phoebe Buffay,"I don't know, I mean, he's a good person, and he can be really sweet, and in some ways I think he is so right for me, it's just... I hate that guy!"
Phoebe Buffay,"Hey, Joey. What's going on?"
Phoebe Buffay,"'Cause he was creepy, and mean, and a little frightening... alright, still, it's nice to have a date on Valentine's Day!"
Phoebe Buffay,I know I am. That's why I can't wear a digital watch.
Phoebe Buffay,"Oh! You know my friend Abby who shaves her head? She said that if you want to break the bad boyfriend cycle, you can do like a cleansing ritual."
Phoebe Buffay,"Yeah. So, we can do it tomorrow night, you guys. It's Valentine's Day. It's perfect."
Phoebe Buffay,"Ok. We can, um, we can burn the stuff they gave us."
Phoebe Buffay,"Or...or we can chant and dance around naked, you know, with sticks."
Phoebe Buffay,"Ok, so now we need, um sage branches and the sacramental wine."
Phoebe Buffay,"Um, that's ok! Ok. All right. Now we need the semen of a righteous man."
Phoebe Buffay,"Ok, yeah, ok. Oh, OK."
