speaker,transcript
Phoebe Buffay,I really don't want to mess up what we have. I'm just-I'm worried it's gonna be a big mistake.
Phoebe Buffay,Which is why my answer is yes!
Phoebe Buffay,Uh-huh! I'm so...happy.
Phoebe Buffay,We're moving in together! Isn't it great! Yay!
Phoebe Buffay,"I know, I'm so excited!"
Phoebe Buffay,"Well, you're not more excited than I am! No way! I'm the most excited!"
Phoebe Buffay,"Okay, yeah, I'll see you later! Don't forget about the moving in!"
Phoebe Buffay,"I couldn't tell him no. He got so sad. Maybe it'll be all right. I do really like him a lot and probably do it eventually anyway and plus, think of all the money I'll save on stamps."
Phoebe Buffay,"No, I just heard when people live together, they split the cost of stamps. Don't they?"
Phoebe Buffay,"Oh, I'm sorry, the oven mitts really freaked me out."
Phoebe Buffay,"No, nothing."
Phoebe Buffay,Yeah.
Phoebe Buffay,"No, as soon as something opens up we'll move right in. Unless it doesn't have a pool, I need a pool."
Phoebe Buffay,Uh-huh!
Phoebe Buffay,"Yeah, I feel great. 'Cause we're moving in together."
Phoebe Buffay,"Yeah, uh-huh, there was nothing. Can I get some water?"
Phoebe Buffay,"Umm, yeah! Today's."
Phoebe Buffay,Are these for rent! I thought people were just bragging!
Phoebe Buffay,Yes. Yes! Fine! I am someone! You want me to say it? I have doubts! I'm sorry!
Phoebe Buffay,Yeah?
Phoebe Buffay,That's so sweet.
Phoebe Buffay,Living with you would make me happy.
Phoebe Buffay,"No, I really wanna live with you! I wanna move in with you!"
Phoebe Buffay,Yes. Definitely! Yes! Let's live in an apartment that we both live in!
Phoebe Buffay,"Oh wait, one sec. One sec. Hey you! Behind the glass! Who are you looking at! I've always wanted to say that when I was in one of these rooms, which was never!"
Phoebe Buffay,"I like waking up with you too. Oh! It's such a beautiful morning. Oh, I can stay here all day."
Phoebe Buffay,We could have breakfast in bed...
Phoebe Buffay,Okay. Oh! Oh no.
Phoebe Buffay,"Oh good, you're all up."
Phoebe Buffay,"Oh yeah, that's over."
Phoebe Buffay,He shot a bird!
Phoebe Buffay,"Yeah. Yeah, I'll be alright."
Phoebe Buffay,"Nah, I don't feel like playing."
Phoebe Buffay,Yeah!
Phoebe Buffay,"Ohh, give him a kiss for me!"
Phoebe Buffay,Bye!
Phoebe Buffay,I am so sorry you got caught in the middle of that. I didn't mean to be so out there. I am furious with him!
Phoebe Buffay,"I'm trying, but man that guy can push my buttons!"
Phoebe Buffay,"Look, I don't wanna talk about it. Okay?"
Phoebe Buffay,You wanna be on my list too? Keep talking! Has anyone seem my list by the way?
Phoebe Buffay,"Uh, it's a piece of paper and it says, ""Ross"" on it."
Phoebe Buffay,"Ohh-oh, chilling!"
Phoebe Buffay,"Oh wait, my grandmother's dead."
Phoebe Buffay,"No! No, her cab! She probably won't be using it; you can drive it to Las Vegas."
Phoebe Buffay,Oh hey Joey! What's up?
Phoebe Buffay,"Yeah, I've been around."
Phoebe Buffay,"Ooh, if you take the northern route there's a man in Illinois with a beard of bees. {Okay, I must protest this, I've lived in Illinois all my life and know of no man with a beard of bees! Wisconsin, on the other hand, might be a different story.}"
Phoebe Buffay,But on the southern route there's a chicken that plays tic-tac-toe.
Phoebe Buffay,"Oh, I know a way that you can decide! All right, I'm going to ask you a series of questions and you answer as quickly as you can."
Phoebe Buffay,"Good, but wait. Okay, all right, here we go. Now I want you to relax. Take a deep breath. Clear your mind. Which do you like better peanut butter or egg whites?"
Phoebe Buffay,Which would you rather be a fireman or a swimmer?
Phoebe Buffay,Who would you rather sleep with Monica or Rachel?
Phoebe Buffay,No thinking! No thinking! Tie or ascot?
Phoebe Buffay,North route or south route?
Phoebe Buffay,Bamn! There you go! Huh?
Phoebe Buffay,"Oh, this guy again."
Phoebe Buffay,"Umm, no thank you."
Phoebe Buffay,Thanks a lot! I just got that jerk out of my mind!
Phoebe Buffay,Bye!
Phoebe Buffay,"Oh, I'm sorry. I didn't see you there."
Phoebe Buffay,"Well, if you don't know I can't help you."
Phoebe Buffay,"Well, I can't help you."
Phoebe Buffay,Apology accepted.
Phoebe Buffay,Uh-huh.
Phoebe Buffay,"Bye, fat ass."
Phoebe Buffay,I don't know! I don't remember!
Phoebe Buffay,"Oh no, I am mad at you. I know that much. But, I am sorry about the fat ass thing. You actually have a very sweet little hiney."
Phoebe Buffay,No.
Phoebe Buffay,No that made me feel precious.
Phoebe Buffay,That game should not be played without my supervision.
Phoebe Buffay,What's in the bag?
Phoebe Buffay,I do!
Phoebe Buffay,"Ooh that is definitely Chandler, Joey, or Ross. Or-or Rachel!"
Phoebe Buffay,"Hey, dude!"
Phoebe Buffay,Oh that's my grandma. And thanks Joey she's having a really great time.
Phoebe Buffay,"Okay Joey? Chandler's here, he was wondering... Okay, I guess he ran out of change."
Phoebe Buffay,"No, don't-don't say I'm sorry with porn!"
Phoebe Buffay,Y'know what you should send him? A cartoon of cigarettes. 'Cause that why he could trade it for protection. No. That's prison.
Phoebe Buffay,Uh-hmm.
Phoebe Buffay,Fauna.
Phoebe Buffay,Garfunkle.
Phoebe Buffay,You said I was boring--Ohh!
Phoebe Buffay,"Oh my God, I remember now! We were playing chess!"
Phoebe Buffay,"Oh, come on! Yes, remember that time on the frozen lake? We were playing chess, you said I was boring, and then you took off your energy mask and you were Cameron Diaz! Okay, there's a chance this may have been a dream."
Phoebe Buffay,Why? Just 'cause you're too lazy to get up off your touchie?
Phoebe Buffay,Okay!
Phoebe Buffay,Hello? Hey Joey!
Phoebe Buffay,Sure! Where is it?
Phoebe Buffay,Ohh! So you're 5639?!
Phoebe Buffay,"Ooh, do you want to talk to Chandler?"
Phoebe Buffay,Who was that?
Phoebe Buffay,Yeah!
Phoebe Buffay,Monica! I'm sorry I'm late! Monica?
Phoebe Buffay,It's okay. What the hell took you so long?
Phoebe Buffay,Which Richard?
Phoebe Buffay,Richard Simmons?! Oh my God!
Phoebe Buffay,"Oh! Okay, that actually makes more sense. So how was it?"
Phoebe Buffay,That is so weird! I had a dream that you'd have lunch with Richard.
Phoebe Buffay,"But again, Simmons. Go on."
Phoebe Buffay,Ooh! So now why can't we tell Chandler?
Phoebe Buffay,"Oh, I can't believe you guys lasted a whole year!"
Phoebe Buffay,Wow! I owe Rachel 20 bucks!
Phoebe Buffay,On a totally different bet.
Phoebe Buffay,Awww! Now you're just my annoying friend Chandler.
Phoebe Buffay,"Okay, I'm gonna go too!"
Phoebe Buffay,"Oh please, you are not gonna ditch again like you did with London."
Phoebe Buffay,"Uh-huh, great story! I'm going!"
Phoebe Buffay,Hey!
Phoebe Buffay,"Hey, you guys, listen, this weekend we're all gonna go to Las Vegas to surprise Joey! Including me!! You wanna go?!"
Phoebe Buffay,Of course you can take a couple days off work because this trip includes me!
Phoebe Buffay,"Oh yeah, so you can walk around naked."
Phoebe Buffay,Naked alone time.
Phoebe Buffay,Uh-huh! Why do you think it takes me so long to answer the door?
Phoebe Buffay,"So, so far is this trip to Vegas better or worse than the trip to London?"
Phoebe Buffay,"Okay, what about after I give you these candies?"
Phoebe Buffay,"Ah-ha! Okay, Las Vegas 1, London 0! I'll be right back."
Phoebe Buffay,"Oh good! All right, so you decided to tell him about the Richard thing."
Phoebe Buffay,Oh no.
Phoebe Buffay,Simmons! Go with Simmons!
Phoebe Buffay,"Okay, London 1..."
Phoebe Buffay,"Hey you guys wait! Guys! This place is so much better than London! Okay? This lady dressed like Cleopatra gave me a coupon, 99 cent steak and lobster dinner. Huh!"
Phoebe Buffay,"For 99 cents, I'd eat you. Okay, I can totally settle down here. It's got everything I could ever want, including Joey! Look! Oh! Look! Hi!"
Phoebe Buffay,Hey! Joey! Hey! Hey!! Wow!
Phoebe Buffay,Why are you dressed as a gladiator?
Phoebe Buffay,So you're a gladiator! Wow!
Phoebe Buffay,Monica had lunch with Richard.
Phoebe Buffay,Noo! But that would've been so cool!
Phoebe Buffay,I love Vegas!
Phoebe Buffay,Thanks.
Phoebe Buffay,Y'know Monica you had a minor setback in your relationship with Chandler. Big deal! It's only Chandler. I am so sorry.
Phoebe Buffay,So go fix it! Go find Chandler! He's probably up in your room! Tell him that you're sorry and that you love him.
Phoebe Buffay,"Sure! Yeah! Las Vegas, number one!"
Phoebe Buffay,Hey!
Phoebe Buffay,Yeah?
Phoebe Buffay,"Ohh, you are so lucky! Hey! So, where's Monica? Did you guys make up?"
Phoebe Buffay,But she just came up here!
Phoebe Buffay,I wonder where she is. That is so weird.
Phoebe Buffay,Would you stop that! Do you wanna know the first thing she said when she came back from her lunch with Richard? She didn't feel anything for him. She loves you!
Phoebe Buffay,"Yes! Now, she feels terrible! She really wants to make up! You gotta find her."
Phoebe Buffay,Good. I should really start wearing hats!
Phoebe Buffay,Hey!
Phoebe Buffay,You guys are here! Yay!
Phoebe Buffay,What? Did you go to a costume party? Let me guess umm Pancho Vila? and you're Bob Saget.
Phoebe Buffay,Yeah!
Phoebe Buffay,"Whoa, what kind of party was this?"
Phoebe Buffay,Ugh!
Phoebe Buffay,That's like the third time that lady's won on a machine I was playing.
Phoebe Buffay,M-M-Mole people?
Phoebe Buffay,Oh. What's a lurker?
Phoebe Buffay,Kills you?
Phoebe Buffay,Ohhh!
Phoebe Buffay,How do you know about this?
Phoebe Buffay,Dance karate?
Phoebe Buffay,Get out of here you lurker! Go on! Get!
Phoebe Buffay,Ohh! You made up!
Phoebe Buffay,"Ohh, get a room."
Phoebe Buffay,I know. Use it.
Phoebe Buffay,"Oh well, lost again. That's it! You and me, outside!"
Phoebe Buffay,"Be cool! Okay lady, your lurking days are over!"
Phoebe Buffay,"Yeah, from now on everyone you lurk, I'm gonna lurk first! You move on to someone else, I'm gonna be one step ahead of you, every single time! And then I'll be on your ass every hour of every day 'til Monday, because that's when I go home. When do you leave?"
Phoebe Buffay,What time? Maybe we can share a cab!
Phoebe Buffay,I won! I won! I finally won!
Phoebe Buffay,Fine! Here! Take a hike toots!
Phoebe Buffay,Sells drugs to kids.
Phoebe Buffay,She sells drugs to kids.
Phoebe Buffay,How about we talk about this over dinner?
Phoebe Buffay,"No! No, you can't arrest me! No!! I won't go back! I won't go back to that hell hole!!"
Phoebe Buffay,"Oh, okay."
Phoebe Buffay,"Hello. My name is Regina Phalange. I'm a businesswoman in town on business. Would you like to see my card? Ooh, what did I do with my file-a-facts? I must've left it in conference room B."
Phoebe Buffay,"Oh my God! May I just say that you two gentlemen have the exact same hands! They're identical! Now, I've never seen anything like that in the business world."
Phoebe Buffay,"No, you threw out Phoebe. I'm Ms. Regina Phalange. Phalange!"
Phoebe Buffay,Okay! Okay! Okay!
Phoebe Buffay,Hey! Don't you give me any of your-Hey!
Phoebe Buffay,"Well, maybe you wouldn't have had you run in the chapel!"
Phoebe Buffay,"What's the big deal, y'know? It's not like it's a real marriage."
Phoebe Buffay,"Yeah, if you get married in Vegas, you're only married in Vegas."
Phoebe Buffay,Really?!
Phoebe Buffay,Oh my God!-Eh! Well...
Phoebe Buffay,"Oh Joey, I'm so sorry. You want some of my breakfast?"
Phoebe Buffay,What about my cab?
Phoebe Buffay,"No, Joey! You borrowed my cab; you have to drive it back."
Phoebe Buffay,"I don't know, it's such a long trip."
Phoebe Buffay,Are you asking me to have a frenaissance?
Phoebe Buffay,"All right. Although I don't think we need one, I never stopped loving you."
Phoebe Buffay,"Um-hmm, yeah. They left me a message; they should be here any minute."
Phoebe Buffay,Well you don't.
Phoebe Buffay,Good! Good! I was just testing you.
Phoebe Buffay,"No, we were talking about tennis. Tennis is more believable."
Phoebe Buffay,Uh-huh! Ross invited us all to watch.
Phoebe Buffay,"Hell, I'm drunk right now! What? I can't have a mimosa with breakfast?! I'm on vacation!"
Phoebe Buffay,"Oh-oh, that's your thing."
Phoebe Buffay,You're thing. You're thing. Y'know? You're the guy who gets divorced.
Phoebe Buffay,"Yes you do! This is your third divorce! You love divorce so much you're probably gonna marry it! Then it won't work out and you're gonna have to divorce it, divorcing guy. I'm so drunk."
Phoebe Buffay,"Okay, you have 19 questions left. Use them wisely. Come on Joey! You can't win if you don't ask any QUESTIONS!!!"
Phoebe Buffay,"Well, you promised me a fun road trip! We've been on the road six hours and you've been asleep for five and a half! We are switching at the next rest stop and you are going to drive all the way back! That will be your punishment, you greedy sleeper!"
Phoebe Buffay,Yeah! And until then you are going to sing to me because the radio's broken and you are selfish but have a nice voice.
Phoebe Buffay,Sing!!
Phoebe Buffay,"How could you pick up a hitchhiker?! He could be a rape-, a rapist or a killer or something!"
Phoebe Buffay,"Y'know what? I'm not talking to you! You go back to sleep! And you, are you a rapist?!"
Phoebe Buffay,Do you like car games?
Phoebe Buffay,I love the license plate game!
Phoebe Buffay,No-No! You need your sleep. Night-night! Shh!
Phoebe Buffay,"Oh, okay."
Phoebe Buffay,"And I have your name and the fact that you're a drifter, so the ball's pretty much in your court."
Phoebe Buffay,Stop it! Stop it no! That's not fair! Y'know I can't resist that beautiful voice!
Phoebe Buffay,You can still sleep at night and stuff.
Phoebe Buffay,Okay. Is it a kind of hot sandwich?
Phoebe Buffay,Is it a meatball sub?
Phoebe Buffay,"No thanks, I've already seen one."
Phoebe Buffay,Always.
Phoebe Buffay,What?!
Phoebe Buffay,Always.
Phoebe Buffay,What?!
Phoebe Buffay,"Wait! Wait! Hi! Listen, Ross can I just talk to you for just a second?"
Phoebe Buffay,"Oh, there's a cab! Taxi!! Good timing, my God, huh? Here you go."
Phoebe Buffay,"Oh, the Angelica!! Go! Go! You didn't get the annulment?!!"
Phoebe Buffay,Ross?!
Phoebe Buffay,"Don't be worried about that! Your tombstone can say whatever you want it to say! It could say, Ross Geller, Good at Marriage! Y'know? Mine's gonna say Phoebe Buffay, Buried Alive."
Phoebe Buffay,"So okay what? You're gonna be married to a girl who doesn't even know about it?!-Op, woman! Sorry."
Phoebe Buffay,"Rachel is one of my closest friends. Although, being the only one who knows anything about this does makes me feel special. Okay!"
Phoebe Buffay,Hey Rach!
Phoebe Buffay,"Sorry, mix up. Hey, how was the movie?"
Phoebe Buffay,Well then you'd better hurry! The Angelica! Go! Go!
Phoebe Buffay,Hey!
Phoebe Buffay,"No, why?"
Phoebe Buffay,You're pregnant!
Phoebe Buffay,"Ooh! That's Good! Wow! But Now If You Were Pregnant, What Would You Name It? Hint Phoebe."
Phoebe Buffay,"Guys, I'm happy too."
Phoebe Buffay,"Wow! Big day huh? People moving in, people getting annulled..."
Phoebe Buffay,"Hmm, something bad to tell Rachel... Bad news for Rachel, what could that be?!"
Phoebe Buffay,"Ross, it's not that big a deal! So you'll been divorced three times, you'll still have a life, you'll go on dates..."
Phoebe Buffay,"Ross, you're being ridiculous! Okay? You are cute and smart and sweet and that is much more important than three stupid divorces!"
Phoebe Buffay,"Y'know that's really fair. Y'know? Most guys who have been divorced three times are like 60. Ross, nobody cares about this except you! This-this embarrassment thing is all in your head! Here, I'll show you! Come here."
Phoebe Buffay,"Hi! Hi! Listen, my friend Ross is about to be divorced for the third time, but wouldn't you date him?"
Phoebe Buffay,"Okay, so what do you think ladies? Who wouldn't be interested? Who wouldn't want to date him?"
Phoebe Buffay,"Okay, what about you? Wouldn't you want a date?"
Phoebe Buffay,Whatever! What about you Meg?
Phoebe Buffay,"She said, ""He's obviously still in love with this Rachel girl."""
Phoebe Buffay,"Well, I thought you loved her when you-when you married her."
Phoebe Buffay,Hey! You could do a lot worse than Joey Tribbiani!!
Phoebe Buffay,"Yes, and now he's using this three divorces reason because he wants to stay married to her because he loves her. I must say, ""Well done!"" Bravo Meg."
Phoebe Buffay,"Okay, bye!"
Phoebe Buffay,So? Did you get the annulment?
Phoebe Buffay,I knew it! Because you love Rachel.
Phoebe Buffay,"Yeah, complicated 'cause of the love."
Phoebe Buffay,I've never been more convinced of your love for her.
Phoebe Buffay,"Oh we do, but not just yet."
Phoebe Buffay,"Okay umm, well, first Chandler and Monica will get married and be filthy rich by the way. Yeah. But it won't work out."
Phoebe Buffay,"I know. Then, I'm gonna marry Chandler for the money and you'll marry Rachel and have the beautiful kids."
Phoebe Buffay,But then we ditch those two and that's when we get married. We'll have Chandler's money and Rachel's kids and getting custody will be easy because of Rachel's drinking problem.
Phoebe Buffay,"I don't want to go into the whole thing, but umm, we have words and I kill him."
Phoebe Buffay,Hey! Check it out! This is unbelievable! Joey has been holding his breath for almost four minutes!
Phoebe Buffay,"Uh-huh, what?"
Phoebe Buffay,Oh!
Phoebe Buffay,"Well, that would be great but then what do we do about Denise?"
Phoebe Buffay,My roommate.
Phoebe Buffay,"Yes, Denise. Denise!"
Phoebe Buffay,Maybe because you never listen to anything that I say. I talk about her all the time! DENISE!!!!!
Phoebe Buffay,Hey.
Phoebe Buffay,"So, what did Rachel say when you told her you were still married to her?"
Phoebe Buffay,You didn't tell her did you?
Phoebe Buffay,"Of course not, because you're in love with her."
Phoebe Buffay,"What do you mean, comforted her?"
Phoebe Buffay,"Ah-ha! A classic sign of love, the hug!"
Phoebe Buffay,"Yeah, not in your case Lovey Loverson."
Phoebe Buffay,"Okay, just tell me this, did you or did you not smell her hair?"
Phoebe Buffay,"Ninety percent of a women's pheromones come out the top of her head! That's why, that's why women are shorter. So that men will fall in love when they hug them! Oh come on Ross, you're a scientist."
Phoebe Buffay,"Okay, whatever you say. But just be careful, all right? Rachel's not in the same place you are."
Phoebe Buffay,"Okay, I didn't understand that, but y'know, maybe that's 'cause you were speaking the secret language of love!"
Phoebe Buffay,Shhhhhh! I'm swamped right now.
Phoebe Buffay,"Umm, I'm trying to move that pencil."
Phoebe Buffay,It worked!
Phoebe Buffay,"Wait, no, look at this! ""Two bedroom, two bath, must be non-smoker, Satan worshipers okay..."" Oh, yeah, but it's on the ground floor."
Phoebe Buffay,I saw it.
Phoebe Buffay,"Umm, I'm talking about that which you already know but won't admit. You love her again; you re-love her!"
Phoebe Buffay,"I can't believe you won't just admit it! Okay, just promise me that you won't do anything stupid."
Phoebe Buffay,What?!
Phoebe Buffay,"Wow! I'm-I'm so happy for you guys. This is so-so, not stupid."
Phoebe Buffay,"No. No, I won't. But I should tell you this, this exact same thing happened to my roommate Denise. She moved in with a guy who was secretly married to her and he said he didn't love her, but he really did, and it just blew up! And that's how she ended up living with me! Okay, that's a lie."
Phoebe Buffay,"I found you in my bed! How'd you whined up there? You are a mystery! Little black curly hair! Little black curly hair! Little black, little black, little black, little black, little black curly hair............"
Phoebe Buffay,"Now if you want to receive e-mails about my upcoming shows, then please give me money so I can buy a computer."
Phoebe Buffay,Yes.
Phoebe Buffay,"Ross, I know what you're thinking."
Phoebe Buffay,"That she's gonna move in with you and maybe then she'll fall in love with you and then when she finds out you're already married, she'll just be happy. Y'know? You're just, you're very sad."
Phoebe Buffay,What?!!
Phoebe Buffay,No!
Phoebe Buffay,"Yeah, Professor and Mrs."
Phoebe Buffay,"Oh! Yeah, y'know you and Ross are still married."
Phoebe Buffay,Just kidding!
Phoebe Buffay,Saved your ass.
Phoebe Buffay,Hi.
Phoebe Buffay,"Well, you know that psychic I see?"
Phoebe Buffay,"Well, she told me that I'm gonna die this week, so I'm kinda bummed about that."
Phoebe Buffay,"Yeah, and I know you guys don't know a lot about psychic readings, but that one is pretty much the worse one you can get."
Phoebe Buffay,I don't-she said y'know that I'd have triplets! But she also said one of them would be black.
Phoebe Buffay,"No, 'cause she didn't tell me I was gonna die until the very end of the session, and I was not gonna waste a whole another hour there! I mean I've only got a week left, y'know? I've really gotta start living now! , leans back, and starts reading.)"
Phoebe Buffay,"Oh, this is it. This what's gonna kill me."
Phoebe Buffay,Hey!
Phoebe Buffay,"Ugh, it's so exhausting waiting for death. Ohh, by the way, do you think you could-"
Phoebe Buffay,I was preparing you for my-didn't you think I was dead? Did that not come off?
Phoebe Buffay,"Yeah, thanks. And listen, can you do me a favor? Could you just umm, wake me up in a couple hours, y'know if you can."
Phoebe Buffay,Hey!
Phoebe Buffay,What's going on?
Phoebe Buffay,Hey! Maybe you'll die!
Phoebe Buffay,"No, we can go together! Just don't wait too long though, okay? 'Cause I'm outta here sometime before Friday."
Phoebe Buffay,"No-no, it'll be fun! We can come back and we can haunt these guys!"
Phoebe Buffay,Hey!
Phoebe Buffay,"Listen to this! My reading was wrong, I'm not going die!"
Phoebe Buffay,Because my psychic is dead! She must've read the cards wrong!
Phoebe Buffay,"Eh, better her than me! Hey, let's bake cookies!"
Phoebe Buffay,Have you really done this before?
Phoebe Buffay,Hey!
Phoebe Buffay,We're just celebrating that Joey got his health insurance back.
Phoebe Buffay,Oh my God!!
Phoebe Buffay,"Okay, this is inexcusable. I am shocked to my very core!"
Phoebe Buffay,Another lie. You have a sickness!
Phoebe Buffay,"Oh, good, good, you guys are here! Listen, how would like to spend tomorrow taking care of three incredibly cute little puppies?!"
Phoebe Buffay,"Okay, well I'll bring them by tomorrow morning. Okay, and uh, by the way, they're not actually puppies, they're Frank and Alice's triplets. Okay, see ya!"
Phoebe Buffay,Please! Please! Please! Please! Oh please! Please! Please! Frank and Alice asked me to baby sit the triplets and I'm nervous 'cause I've never done that before by myself!
Phoebe Buffay,"What about me? I just found out that Denise is leaving town for a while, I don't have a roommate."
Phoebe Buffay,Maybe you could be my roommate!
Phoebe Buffay,Yeah!
Phoebe Buffay,"Umm, she said she'd be back December 26th."
Phoebe Buffay,I'm doing okay. I think it's going well. Do you think they're having fun? Am I talking to fast?
Phoebe Buffay,"Na-uh, no, we are all responsible for our own babies."
Phoebe Buffay,"That sounds really great, but maybe you should be in charge of wiping."
Phoebe Buffay,Yeah? Well this is not what I ordered.
Phoebe Buffay,Hey!
Phoebe Buffay,I don't know why I was so nervous about this. And I don't know why Frank and Alice are always complaining. This is so easy.
Phoebe Buffay,"No Chandler, they can swallow one of those little parts! And also, look at his smooth area, that's just gonna mess them up."
Phoebe Buffay,What?!
Phoebe Buffay,"Oh, look at little Leslie stretching in her sleep."
Phoebe Buffay,"Oh, I can still do that."
Phoebe Buffay,How did that happen?!!
Phoebe Buffay,"Yeah, but only a genius would swallow a sonic blaster gun."
Phoebe Buffay,"What?! No, you can't, you can't leave me here with them! We're baby-sitting!"
Phoebe Buffay,But you-you can't leave me with them! We-we're a team! We're playing a zone! They're gonna triple team me!
Phoebe Buffay,"But no, because a doctor won't be able to help him, it's just gonna y'know naturally pass through his system in like seven years."
Phoebe Buffay,I'm pretty sure it's gun.
Phoebe Buffay,"A real man wouldn't just run to the hospital! No! What would, what would Krog do?"
Phoebe Buffay,"Me taking care of you is no problem, huh? You guys feel safe. Right? Okay, I'm gonna take that spit bubble as, ""Yeah, I do!"" Okay, after I get rid of this dirty diaper Leslie, I'll set you up with a clean one. Okay, I'm sorry. I didn't mean to scare you. I just have to clean that up. Okay? 'Cause let's face it, we're at Monica's. I broke it. All right. Well, that's just the way that goes. Okay, good. Why are there only two of you? Where is Leslie? Well, you can't answer. Leslie? Where are you Leslie? Leslie, now would be a good time for your first words! Well, look at you! Hey! You are a little bit mischievous! My gosh! Oh, you're a lot mischievous! Well, it'll dry. Okay, you sit with your brother and sister now-who aren't there!"
Phoebe Buffay,How do you feel?
Phoebe Buffay,"Okay, so I totally took care of the babies all by myself! I fed 'em, bathed 'em, and put 'em to bed."
Phoebe Buffay,"I know, the babies are asleep."
Phoebe Buffay,I did it! I took care of the babies all by myself!
Phoebe Buffay,So is Joey going to have to give up the apartment?
Phoebe Buffay,"Well, how much do you think he needs?"
Phoebe Buffay,Why don't you hire him as an actor? You could have him dress up and put on little skits. Whatever you want.
Phoebe Buffay,"And also, my birthday."
Phoebe Buffay,What a mean thing to say! I would never tell you it's not your birthday!
Phoebe Buffay,Hey! So you guys have anything planned for the big last night?
Phoebe Buffay,"My God, I can't get a minute of peace around this place."
Phoebe Buffay,Oh my God! Monica's just gonna kill you.
Phoebe Buffay,"Well, what you're wearing is fine for that."
Phoebe Buffay,I have plans.
Phoebe Buffay,That's right.
Phoebe Buffay,Okay.
