speaker,transcript
Ross Geller,I know. Can you believe that?
Ross Geller,"Married couples send out cards, families send out cards, people who have been dating for a couple of months do not send out cards! What-what is she crazy?!"
Ross Geller,Hey!
Ross Geller,"Huh. Wow, this is great."
Ross Geller,"Well, we-we haven't said that to each other yet, but I guess its okay to say it to other people."
Ross Geller,"A hundred?! Well, I-I guess I'll take a-Mona, uh...I-I'm not sure about the whole uh, card thing."
Ross Geller,"Sending out a holiday card, together, I mean I just don't know if we're really quite there yet."
Ross Geller,Yeah.
Ross Geller,Huh.
Ross Geller,Hmm...
Ross Geller,Let's do the card!
Ross Geller,The card! I think we're there!
Ross Geller,"Really?! I mean, even with the card?"
Ross Geller,Hey!
Ross Geller,"Oh yeah, yeah we're moving forward. You'll be getting our card!"
Ross Geller,"Yeah, we're not just doing a card! Y'know, she-she also wants to have the conversation about where the relationship is going."
Ross Geller,"I know! I know! Why do you guys need to have this conversation?! Huh? I mean no self-respecting man would ask a woman, ""So, where is this going?"""
Ross Geller,"Hey! You were a closed book! Okay? I'm not a mind reader! Besides, I hate those conversations. I'm horrible at them. Really! Maybe-maybe I need kind of a gesture. Y'know, something that says we're moving forward without having to talk about it."
Ross Geller,Smaller than that.
Ross Geller,"Uh, bigger than that."
Ross Geller,Whoa-hello! We were closer with the mixed tape.
Ross Geller,"Yeah I-I don't-I don't think I'm quite there yet, but I could say I looove spending time with you."
Ross Geller,"Forget it. I-I-Y'know what? I'll just have the conversation. I'll just say I like things the way they are, and hope for the best. What do you think Rach?"
Ross Geller,"Here we go. Mona umm, I think it's time we-we had a conversation about-about where things are with us."
Ross Geller,"Aw, we-we are so... So umm, well I-I-I like you and I-I love umm, y'know hanging out with you. And I mean-I'm having a lot of fun."
Ross Geller,"I mean, there's no point in spending time with someone if-if it's just fun. It's gotta be, it's gotta be going somewhere right? So where-where is it going? Ah! That's-that's the real question. And-and the answer is...is it's going somewhere...fun. Now I-I know what you're thinking, fun was fine for you like ten years ago y'know, but you're-you're not getting any younger. No I mean-No not you, not you, you-you are getting younger. I mean-you-you look like you're getting younger by the second-What's your secret?"
Ross Geller,"Well, well to sum up, we're having fun, you look young."
Ross Geller,But that's not enough. So... So...here's a key to my apartment.
Ross Geller,Really.
Ross Geller,"Not just a key, I gave her the only key! I am now a homeless person in a very serious relationship."
Ross Geller,"Oh great, I live on the street."
Ross Geller,"Okay, and oh I'm gonna need a bunch of extra keys. Apparently I give them away for no reason at all."
Ross Geller,No. That guy is.
Ross Geller,I'm trying to tell you I made you a mix tape.
Ross Geller,I love you!
Ross Geller,"Hey! Oh, I'm so glad you guys are here. I've been dying to tell someone what happened in the Paleontology department today."
Ross Geller,"Professor Neuman, the head of the department, so...."
Ross Geller,"No, I get to teach one of his advanced classes! Why didn't I get head of the department?"
Ross Geller,"...which brings us back, of course, to Greely's theory of dominance. Okay, that-that's all for today. Oh, uh does anyone know where the Freeman building is?"
Ross Geller,"What?! That-that's all the way cross town, I'm supposed to teach a graduate seminar there in ten minutes."
Ross Geller,Move it! Move it! Move it!! Hey!!! I'm the teacher!!
Ross Geller,"Hello. I'm sorry I'm a little late. Ah--Whoa! A lot late. Let me start by uh, by introducing myself, I am Professor Geller. So to sum up, I'm Professor Geller. Good job today."
Ross Geller,"No, I ran. It was really far, and when did people stop understanding the phrase, ""Get the hell out of my way!"""
Ross Geller,"Ugh, between the traffic that time of day and all the one-way streets it'll take me twice as long. Besides, I teach the class three times a week, who am I? Rockefeller?"
Ross Geller,"Well I have to. Okay? If I don't, they'll take the class away from me. And...I already put it in my family newsletter."
Ross Geller,"You've seen it, the Geller Yeller."
Ross Geller,"Besides, I-I think I figured out a much faster route, I'm sure I can make it this time. I just...I just can't be afraid to get a little bit...hit by cars."
Ross Geller,"Yeah!!!! Yes, I made it! I'm on time! Okay, why don't we all uh, open our books to page 23. Where... Where you will see...a uh...a bunch of uh...red spots. Okay, umm, why don't, why don't you all start to read, while I-"
Ross Geller,Phoebe!!
Ross Geller,"So is everybody here? I got here a little early myself. Let us begin. Now, the hydrosaurids have been unearthed in two main locations. Here. Here. Now as for the hydrosaurs..."
Ross Geller,Right.
Ross Geller,"No-no, we talked about it. We don't want to know. All we care about is that it's happy and healthy."
Ross Geller,And smart!
Ross Geller,With an aptitude for science.
Ross Geller,Really? Me too!
Ross Geller,"Maybe. But it wouldn't hurt to have a backup, you know? Uh, Rach-Rach, what were you thinking?"
Ross Geller,Huh. That's a really pretty name for-for an industrial solvent.
Ross Geller,"Well, OK, it's for a boy. Well, I know it's a little out there, but...Darwin."
Ross Geller,You're just saying that 'cause I said no to your name!
Ross Geller,All right.
Ross Geller,That sounds fair.
Ross Geller,Veto.
Ross Geller,"Rain? Hi. Hi, my name is Rain. I have my own kiln, and my dress is made out of wheat."
Ross Geller,"Okay, how about, for a guy, Thatcher?"
Ross Geller,"Fine, you go."
Ross Geller,Huh.
Ross Geller,"Oh, veto. How about-Ooh, I like Ruth! What about Ruth?"
Ross Geller,Veto. Stewart?
Ross Geller,Veto. Helen?
Ross Geller,"I don't think you had an open mind about the name Ruth. I mean, come on, little Ruthie Geller, how-how cute is that?"
Ross Geller,"Uh, no. No, we're not."
Ross Geller,"No, no, we want to wait, right?"
Ross Geller,"What? Rach! Come on, that's terrible! They're...uh...they're babies. They're-they're all beautiful."
Ross Geller,"Yeah, why is it staring at me? I think it knows I'm talking about it. Don't-don't you-Wh-Wha-Hey!!"
Ross Geller,You're looking!
Ross Geller,I saw you!
Ross Geller,Shame on you! Ugly baby judges you!
Ross Geller,"No, no, no, no! Don't tell me! I don't want to know!"
Ross Geller,Momentary lapse. Don't-don't you have any self-control?
Ross Geller,Hey.
Ross Geller,"Rach, I-I can't tell you how-how much that means to me! Ohh... Wait a minute. Wait a minute. You-you hated the name Ruth! Why-why would you change your mind? Unless, you know we're never going to have to use it. You did see the folder. You know it's a boy!"
Ross Geller,"I don't think so! You're just giving me Ruth so you'll get to name it when it's a boy, and that's when you'll swoop in and name him Heath or Blaine or Sequoia."
Ross Geller,Veto.
Ross Geller,"Unless... You anticipated that I would figure all this out and you know that it actually is a girl, and you really do want her to be named Ruth! Well, I'm not falling for that! Okay? Ruth is off the table!"
Ross Geller,Not like this!
Ross Geller,"So, I uh... I called the doctor and now we both know the sex of the baby."
Ross Geller,That's right. The student has become the master.
Ross Geller,"Oh, come on, you know it's a girl!"
Ross Geller,You really didn't know?
Ross Geller,No.
Ross Geller,No.
Ross Geller,Yes. I'm... I'm sorry. I'm so sorry.
Ross Geller,I know! I know. You know what? I'm putting Ruth back on the table!
Ross Geller,Permission to veto.
Ross Geller,Hello?
Ross Geller,"Well hey! What's going on? Ooh, cool boat--Oh, no. Hey, did you, did you tell them?"
Ross Geller,I hope you're a better father than you're a friend!!
Ross Geller,Hey!
Ross Geller,What?! It is?!
Ross Geller,"Hey, when-when was it kicking? What happened?"
Ross Geller,"My God, the baby's kicking. That's great. Although I...kinda wish I-I would've been there to feel the kicking for the first time y'know."
Ross Geller,"Look, I-I don't want to miss anymore baby stuff. So...Here. Here's my new pager number, okay? Anytime anything pregnancy related happens use it! I'll be there! Okay? I don't care if it's three in the morning and all you want is ice cream."
Ross Geller,Is everything okay?
Ross Geller,"Your page said come to the hospital, what? What was it? What happened?"
Ross Geller,"Oh. Oh. Thank God, most women don't even feel them."
Ross Geller,Oh when you beeped me I was on line at the concession stand at the movie theater.
Ross Geller,No I-Mona!
Ross Geller,What? Why? What's wrong?
Ross Geller,"No really, you tell me what's up."
Ross Geller,"So, thanks so much for bringing her to the hospital."
Ross Geller,"Yeah but still, I mean it should've been me. I'm the dad."
Ross Geller,"Hey uh, I brought you some lunch."
Ross Geller,Well yeah!
Ross Geller,What?! What?! Rach what?!
Ross Geller,"I made her favorite, tuna salad with pickles."
Ross Geller,"I-I'm sorry Rach, I didn't know. Are you gonna be okay?"
Ross Geller,I can't believe this! I shouldn't be the one making her throw up!
Ross Geller,"Yeah? Not to you, because you know this stuff. I don't know any of it and I'm the father. I wish I'd be more involved y'know."
Ross Geller,Yeah.
Ross Geller,No I-I-I would love to be around for you and the baby. And we-we can just try it like on a temporary basis.
Ross Geller,So? Sure! But it-it wouldn't be anything romantic. And I'm-I'm dating Mona-Damnit Mona! I was supposed to meet her like an hour ago! What is wrong with me?!
Ross Geller,"No! No it's not. Joey, this is a smart idea."
Ross Geller,Really?
Ross Geller,Oh Rach that's great. That's great.
Ross Geller,"Oh, I'm actually on my way to tell her right now. Yeah, she's been away all week visiting her parents, but she'll be cool. I mean, she's been so supportive. She-she even got the baby a tiny T-shirt that says, 'Fossils are my friends.'"
Ross Geller,"Uh, I'm going to take off."
Ross Geller,What is it?
Ross Geller,All right. 'Candy and Cookie?'
Ross Geller,"Hey, what's behind your back?"
Ross Geller,You don't want my opinion?
Ross Geller,"Come on, I'm your older brother, ask me!"
Ross Geller,The red one.
Ross Geller,"Hey! So, how was Atlantic City?"
Ross Geller,Yeah?
Ross Geller,"Wha-? Oh, come on. You didn't have to-saltwater taffy?! Thanks! This is interesting. You know, most people think this is made with sea water, but it's actually made with, uh, salted fresh water. That's not interesting."
Ross Geller,I do too! I missed you!
Ross Geller,"Oh, it was good! It was good. Actually, the baby started kicking!"
Ross Geller,Yeah! I know! It was. Oh... the only sad thing is I wasn't around when it happened for the first time.
Ross Geller,"Yeah, I'm missing out on all this other stuff, too. So, Joey suggested Rachel move in with me."
Ross Geller,What?
Ross Geller,Huh...uh-huh.
Ross Geller,Just a second!
Ross Geller,"I don't know, she seemed to think it was such a crazy idea! Um, plus, she, uh, she got me taffy!"
Ross Geller,Ever?!
Ross Geller,"Oh, no, no, no, I will! I just want to butter her up, first! You know, I'm going to take her to an amazing Valentine's dinner. Do all this romantic stuff, and then, just when she thinks I'm the best boyfriend in the world, then I'm going to tell her that my pregnant ex-girlfriend is living with me."
Ross Geller,"Well, I'm, uh, going to pick up Mona. What have you got going tonight?"
Ross Geller,"Y'know, it's interesting! Most people think that's made with seawater, when in fact-"
Ross Geller,"Mona? What are-hi! What are you doing here? I'm, um, supposed to pick you up!"
Ross Geller,Ayyyayyyy!
Ross Geller,I have no idea!
Ross Geller,"Uh...lately, she just likes hanging out here."
Ross Geller,I think she's lonely.
Ross Geller,I know.
Ross Geller,"No, no. She's way to emotional. And by emotional I mean crazy."
Ross Geller,"Mm-hmm. She's-she's emotional, but, but ballsy."
Ross Geller,"And you thought she was going to be in our way! So, why don't you, uh, open the champagne, and I'll be right back. I've got a surprise for you."
Ross Geller,Please start drinking!
Ross Geller,Happy Valentine's Day! ...Or something to remember me by.
Ross Geller,"Hey, hey, man!"
Ross Geller,Uh...Mona just dumped me.
Ross Geller,"Well, with everything that's been going on lately, I haven't exactly been the perfect boyfriend. You know, I, uh, I didn't tell her I got Rachel pregnant. I gave her a key to my apartment, and then had the locks changed! And then I lied to her about Rachel moving in with me. In a way, I actually judge her for not breaking up with me sooner, you know?"
Ross Geller,"Yeah. Wait a minute. What are you doing here? Joey Tribbiani without a date on Valentine's Day? What's going on, huh? Girl trouble?"
Ross Geller,Really?!
Ross Geller,"Oh, sorry. Well, look, maybe I can help you with it."
Ross Geller,"Hey, whatever it is, I am sure it has happened to me. Y'know, actually once-once I got dumped during sex."
Ross Geller,"Anyway, so, uh, so what is it?"
Ross Geller,C'mon! Joey! What is it?
Ross Geller,"Hey, hey, it's me. Why can't you tell me?"
Ross Geller,She's not a Tribbiani?
Ross Geller,"I knew it. So, is she someone from work?"
Ross Geller,"Well, uh, does she like you?"
Ross Geller,Why not?
Ross Geller,"So, uh, this guy, she used to go out with, is, uh... is he still in love with her?"
Ross Geller,Okay. Um... is he a good guy?
Ross Geller,Then talk to him! He might be fine with it.
Ross Geller,"Joey, it's worth finding out. I mean, if you really like her."
Ross Geller,"Okay, Joey, you know what? You have to go for it. How often does this happen to you, huh? You owe it to yourself."
Ross Geller,"I'm going to...uh...I'm going to, um, put the bourbon in it at home."
Ross Geller,"Anyway... seriously, uh...just...just talk to the guy, okay? And tell me how it goes."
Ross Geller,"So, uh, this guy, she used to go out with, is, uh... is he a good guy?"
Ross Geller,Then talk to him! He might be fine with it.
Ross Geller,"Joey, it's worth finding out. I mean, if you really like her."
Ross Geller,"Okay, Joey, you know what? You have to go for it. How often does this happen to you, huh? You owe it to yourself."
Ross Geller,"Did you um-I'm sorry, did you just say it's Rachel?"
Ross Geller,"Um, you...you like Rachel?"
Ross Geller,Rachel?!
Ross Geller,But R-R-Rachel-Rachel?!
Ross Geller,"It's not a big deal? Oh, I'm sorry I just...um, I...what about all the stuff you-you just said? I mean how about, I like-you-you can't stop thinking about her. Like how you can't sleep?"
Ross Geller,Rachel who's carrying my baby? Rachel?
Ross Geller,Y'know what? I-I gotta go.
Ross Geller,I just-y'know-I-I just have one-Rachel?!
Ross Geller,Hey.
Ross Geller,"Oh y'know, I still-I can't believe it. Joey and Rachel I mean it's... It's like you and me going out, only weirder!"
Ross Geller,"Oh my God! What if, what if they get married? Then he'd be the stepfather of my child."
Ross Geller,"Sure, because women never like Joey. Y'know, I think he's a virgin."
Ross Geller,He's not?
Ross Geller,Why?
Ross Geller,"Hate him? I... No, I don't hate him. It's just it's Rachel, y'know?"
Ross Geller,"Okay. Okay, I'll talk to him."
Ross Geller,Hey.
Ross Geller,"No, I don't want to hit you."
Ross Geller,No.
Ross Geller,"No, no I don't want to do anything to you. All right? I just want to tell you that I'm not mad at you and...and that I certainly do not hate you. I just, I just came here to say that."
Ross Geller,Uh...yeah sure.
Ross Geller,Okay.
Ross Geller,Thank you.
Ross Geller,What?! You're in love with her.
Ross Geller,"Umm, no."
Ross Geller,I think you need to tell her how you feel.
Ross Geller,"No, I'm serious. You-you need to find out where she is, because if she's not where you are, then you can start to move past this."
Ross Geller,If she is where you are then uh...then my feeling weird about it shouldn't stand in the way.
Ross Geller,"Yeah. Look if-if she's gonna end up with somebody else, the truth is she couldn't find a better guy. So..."
Ross Geller,So when do you think you're gonna talk to her?
Ross Geller,"I'm understanding, but let's not get carried away."
Ross Geller,"Yeah, tell me about it."
Ross Geller,"Hey! Has anyone seen my shirt? It's a button down, like a, like a faded salmon?"
Ross Geller,Faded salmon color.
Ross Geller,Great! Great. Then I must've left it at Mona's. I knew it!
Ross Geller,That's my favorite shirt! Okay? I love that shirt!
Ross Geller,"I don't know. I mean I-I guess I could. It's just that we didn't really end things such good terms. And if I go over there I'd be ignoring the one thing she asked me to do when we broke up, jump up my own ass and die."
Ross Geller,"Mona? Okay, if I were a salmon shirt, where would I be?"
Ross Geller,Hello!!
Ross Geller,Not touching myself if that makes anyone less uncomfortable.
Ross Geller,"Item J437-A, color: winterberry. Hi umm, listen come here, come in. I'm so-so sorry about yesterday. I-I'm really sorry. It's just that I..."
Ross Geller,You do?
Ross Geller,Oh God you're right.
Ross Geller,No.
Ross Geller,Sure. Yeah.
Ross Geller,"Uh, yeah, you sure you want to after what happened at their 20th?"
Ross Geller,"Okay, hopefully this time mom won't boo you."
Ross Geller,Hey!
Ross Geller,Aww that is so cool.
Ross Geller,"Aww! Chi-Chi! Oh, I loved this dog! Y'know Monica couldn't get braces because Chi-Chi needed knee surgery."
Ross Geller,You were the 200-pound 11-year-old who rode her!
Ross Geller,"Ah, actually, I'm sorry we-we probably should get going."
Ross Geller,"Well, there is an Arby's in the shape of a tee-pee."
Ross Geller,"So uh, he seems like a nice guy."
Ross Geller,Ya wanna hang back and take our own cab?
Ross Geller,Hi! Hey mom.
Ross Geller,"That's a good question, dad. That's a good question..."
Ross Geller,Wha-What?
Ross Geller,Dad so what we have to pretend that we're married?
Ross Geller,Can you believe that?
Ross Geller,"No, us having to lie about being married."
Ross Geller,"Hi Aunt Lisa, Uncle Dan."
Ross Geller,We love marriage!
Ross Geller,Hey.
Ross Geller,I'm so we weren't in the car! Did he ever let up?
Ross Geller,This room! This night! That waiter! His shoes! I must take a mental picture! Ooh sorry...
Ross Geller,"That depends, how much did you hear?"
Ross Geller,What was wrong with Mona?
Ross Geller,Yeah baby!
Ross Geller,"No, no, it was just our parents and 1 or 2 friends. It was a small wedding."
Ross Geller,Would you excuse us for a second? Umm.... what are you doing?
Ross Geller,"Okay, okay. Ooooh, ooh maybe I rode in on a Harley."
Ross Geller,"Well, um, actually, I-I took her to the planetarium. That's-that's where we had our first date. Um, she walked in and I had the room filled with lilies, her favorite flower..."
Ross Geller,"Then, Fred Astaire singing The Way You Look Tonight came on the sound system, and the lights came down. And I got down on one knee and written across the dome in the stars were the words ""Will you marry me?"""
Ross Geller,"Oh, no, Mom, it's just Monica this year."
Ross Geller,"No, of course, Um... Um, everybody? Um, I-I just wanted to say...on behalf of my new bride, Rachel , and myself. Umm, that if...if in 35 years, we're half as happy as you guys are, we'll count ourselves the luckiest people in the world."
Ross Geller,"...and then, we could've gone from the ceremony to the reception with you in the sidecar!"
Ross Geller,But having a dove place the ring on your finger would've been no problem?
Ross Geller,"Yeah! And! And, it was the easiest 400 bucks I've ever made."
Ross Geller,Yeah.
Ross Geller,"I know, I know it was stupid."
Ross Geller,"No, actually I thought about it when, when we were going out. It's how I imagined I uh, I would ask you to marry me."
Ross Geller,"It's a good thing I didn't do it, because it sounds like it would've been a very expensive wedding. Okay, good night."
Ross Geller,Even if the sidecar had a windscreen so your hair wouldn't get messed up?
Ross Geller,That's all I'm askin'.
Ross Geller,Y'know I don't understand why they didn't cry. It was a beautiful speech.
Ross Geller,"Hey! All that stuff you said about true love, you were right, I mean, we did learn a lot from Mom and Dad! And that picture of Chi-Chi with her mischievous grin. And what you said about Nana. Ohh, yeah she really would've wanted to be there. And you know what? I think she was."
Ross Geller,Hey!
Ross Geller,Why'd you say no?
Ross Geller,"Just then or-or all the time, 'cause we-we have jobs y'know."
Ross Geller,Shhh! We're not talking.
Ross Geller,"Uh, double latte, extra foam."
Ross Geller,"Come on, it's fun!"
Ross Geller,Are you serious?!
Ross Geller,Wow! We are pretty good at this!
Ross Geller,Hey! We totally forgot about lunch!
Ross Geller,It tastes like feet!
Ross Geller,Are you kidding?
Ross Geller,Who just lost the respect of her unborn child.
Ross Geller,"Yeah, so far nothing stupid."
Ross Geller,"Uh no, no just-just that he is a great guy."
Ross Geller,"Yeah, you too."
Ross Geller,"All right I've been feeling incredibly guilty about this, because I wanna be a good friend, and damnit I am a good friend. So just, just shut up and close your eyes."
Ross Geller,"Wait a minute! I saw that! On The Discovery Channel, yeah! About jellyfish and how if you... Ewwww!! You peed on yourself?!"
Ross Geller,Your make-up!
Ross Geller,Okay. Now-now-now should I climb down your front so we're face to face or-or should I climb down your back so we're-we're butt to face.
Ross Geller,I would say that.
Ross Geller,"Okay, here I go."
Ross Geller,"I prefer not to answer that right now, I'm still carrying a little holiday weight."
Ross Geller,It really was.
Ross Geller,Hi Jill.
Ross Geller,Amazing! Amazing!
Ross Geller,Wow! This picture of you sure is steamy.
Ross Geller,Did you just wink at me?
Ross Geller,Oh cool!
Ross Geller,Well do you want some help?
Ross Geller,Awesome!
Ross Geller,Yeah!
Ross Geller,"Well uh, I-I'm a paleontologist. Umm, I-I live in New York. I have a son Ben. Uh, hi Ben! And uh..."
Ross Geller,"I'm sorry, I don't believe contestants are allowed to talk to each other."
Ross Geller,"The wheel has not been my friend tonight Joey. Uh, I'll take another question."
Ross Geller,"It's okay, I'm ready."
Ross Geller,The fear of Triscuts!
Ross Geller,"It's possible, they have really sharp edges."
Ross Geller,"Wait a minute, I-I believe I'm entitled to use my Angel Pass for a free turn?"
Ross Geller,Y'know what? You're just upset because you're losing.
Ross Geller,What?!
Ross Geller,You don't think it's a little crazy that you get all my points just 'cause you...
Ross Geller,Hungry monkey! Haaa! I'd like a Wicked Wango card!
Ross Geller,"Oh. Oh! Oh my God! Okay, I know this, give me-give me a second!"
Ross Geller,Shut up! I Dream of Genie!
Ross Geller,I'd like to spin the wheel!
Ross Geller,Is there a hopping bonus?
Ross Geller,Ben Franklin.
Ross Geller,Queen Victoria.
Ross Geller,Noooo!!! Every time!!!
Ross Geller,Yeah!!
Ross Geller,Hey!
Ross Geller,I just Bamboozled Chandler! Which is not uh sexual thing. That was a quick shower.
Ross Geller,Wow! It looks like we got a lot of good stuff.
Ross Geller,A Play-Dough Barber Shop?
Ross Geller,"Uh, what?"
Ross Geller,"What-You're not serious. I mean she's a very nice woman, but there is no way we can take eight weeks of her. She'll drive us totally crazy."
Ross Geller,Hi roomie!
Ross Geller,Well we...we don't have a garage.
Ross Geller,"Y'know what? Maybe, Mrs. Green, it's not absolutely vital that you live with us."
Ross Geller,I'm-I'm sure that's not true.
Ross Geller,"Well uh, y'know what? Even if she doesn't know anything, I do! I have a son. And his mother and I didn't live together, and whenever he was with me I took care of him all the time, by myself."
Ross Geller,Yeah.
Ross Geller,"That's a different issue. Uh, the point is, when the baby comes I will be there to...to feed her and bathe her and change her. And more than that I want to do all those things."
Ross Geller,"Yes! Yes, you're gonna be so missed."
Ross Geller,Well you're gonna be a wonderful grandma.
Ross Geller,"Oh, come on, every first time mother feels that way. You'll-you're gonna pick it up. Hey! You will! Uh look, y'know when you first came to the city? You were this spoiled helpless little girl who-who still used daddy's credit card. Do you remember?"
Ross Geller,Look at you! What-You're-you're this big executive! You are much more capable than you give yourself credit for. I-I have no doubt you're gonna be an incredible mother.
Ross Geller,I'm telling you.
Ross Geller,Oh.
Ross Geller,You sure?
Ross Geller,All right then. Rachel Green! Let's play Bamboozled! How do you test the temperature of the baby's bath water?
Ross Geller,Excellent! How do you put a baby down for a nap?
Ross Geller,"That's correct! This is an audio question, what do you do when the baby makes this sound?"
Ross Geller,"Excellent! Excellent, now-now do you want another question or a Wicked Wango card?"
Ross Geller,"Oh, I'm sorry you've been Bamboozled! You're gonna be a terrible mother! I've lost sight of why we're doing this!"
Ross Geller,Hey you guys I got some bad news.
Ross Geller,"No, Monica's restaurant got a horrible review in the Post. I didn't want her to see it, so I ran around the neighborhood and bought all the copies I could find."
Ross Geller,Umm...
Ross Geller,"But the good news is, no one in a two-block radius will ever know."
Ross Geller,"Yeah, they all know."
Ross Geller,What?! What?
Ross Geller,Are ya?
Ross Geller,What are you doing up?
