speaker,transcript
Ross Geller,Who would you rather be Simon or Garfunkle?
Ross Geller,Why are you mad at me?
Ross Geller,When did I say you were boring?!
Ross Geller,Phoebe! You and I have never played chess!
Ross Geller,"Hey Rach, can you pass me the TV Guide?"
Ross Geller,Hey!
Ross Geller,"Oh, but I've got tickets to the Van Gogh exhibit! I've been waiting like a year for this."
Ross Geller,What'd you say?
Ross Geller,Is that supposed to be an insult?
Ross Geller,"So Rach, maybe you and I could fly out together Saturday."
Ross Geller,Yeah? All right I'll call the airlines.
Ross Geller,"Oh my God! That's Rachel naked! I can't look at that! I am looking at this. Okay, vivid colors, expressive brush strokes-Unless she wants me to be looking at that. She knows I'm home. She knows I can see her. What kind of game is she playing? I think maybe someone's lonely tonight. Oh-ho, Dr. Geller! Stop it! You're being silly! Or, am I?"
Ross Geller,Hey.
Ross Geller,May I come in?
Ross Geller,Do you want me too?
Ross Geller,"So do I. Okay Rach, before anything happens I just want to lay down a couple of ground rules. This is just about tonight. I don't to go through with this if it's going to raise the question of ""Us."" Okay? I just want this to be about what it is!"
Ross Geller,The physical act of love.
Ross Geller,Oh so-so you weren't trying to entice me just now with your-your nakedness?
Ross Geller,You weren't trying to entice me with your nakedness.
Ross Geller,No! No! No! No-no-no-no.
Ross Geller,"Can we, can we just forget this ever happened?"
Ross Geller,Thank you.
Ross Geller,"All right I guess I'm, gonna go pack."
Ross Geller,Yep! That's hilarious!
Ross Geller,"Y'know, last night was embarrassing for you too."
Ross Geller,Uh-huh. But it was a first for the rest of my building.
Ross Geller,What?! You totally get embarrassed!
Ross Geller,Is that so?
Ross Geller,Hey lady! I don't care how much you want it! Okay?! I am not gonna to have sex with you in the bathroom!
Ross Geller,Hey! Y'know that teacher who had a baby with her student?
Ross Geller,What the? What...
Ross Geller,"Ohh, it was the best!"
Ross Geller,I think the check in is that way.
Ross Geller,Phoebe!
Ross Geller,"Hey, you wet my pants!"
Ross Geller,Rach! Wait! The men's room is that way.
Ross Geller,What?
Ross Geller,"Oooohhh, I'll bet she's one of those people."
Ross Geller,"What? No-no, a lurker."
Ross Geller,"Okay when you're playing a machine and it hasn't paid out, a lurker waits for you to give up and then..."
Ross Geller,No. They swoop in and steal your jackpot.
Ross Geller,Uh-hmm.
Ross Geller,My nana used to do it. That's how she paid for all my dance-karate lessons.
Ross Geller,"Yes, it's a deadly but beautiful sport."
Ross Geller,What?!
Ross Geller,"Oh my God! Rach-Rach, are-are-are you sure?"
Ross Geller,Joey!!
Ross Geller,Thanks man.
Ross Geller,"Hey listen I uh, talked to Chandler, sorry about the movie."
Ross Geller,Your what?
Ross Geller,What?! That's not gonna make you any money!
Ross Geller,"Yes, hello. I have a question. Umm, I used your pen to draw on my friend's face. A beard and a moustache. Thank you. No, she didn't think so. I know it's like anyway, umm well make-up didn't cover it and we've tried everything to get it off and nothing's worked. What-what do we do? Yeah. Uh-huh. Yeah. Oh! Okay. Okay, thank you! Yeah, it's not coming off."
Ross Geller,"Umm, he said he thought I was funny. So... Okay, look-look umm, let's just go downstairs, we'll have some fun, and you will forget all about it."
Ross Geller,"Oh, come on! Rach, it's-it's not that bad."
Ross Geller,"Look, just because some idiot drew on your face doesn't mean you shouldn't have any fun! Okay? And besides, hey-hey-hey no one is even gonna look at you. Okay? This is Vegas! Hello! There are tons of other freaks here! There are tons...of...freaks here. No other. No. Come on! No one will notice, I swear!"
Ross Geller,"Okay, there was some staring and pointing."
Ross Geller,"Oh, hey y'know, they-they really overcharge you for that stuff. But who cares?! Because it's all on me! That is, one big drink!"
Ross Geller,Umm... Wow! That's-that's some pricey nut!
Ross Geller,"Really like those Macadamia nuts, huh?"
Ross Geller,"All right. Y'know what? We don't have to go downstairs! We can bring Vegas up to us! All right, come on, come on, we'll play some blackjack. Here we go. 13."
Ross Geller,"Oohh, 23. Which is what we play to at this casino! You win 10 dollars!"
Ross Geller,You're right!
Ross Geller,We need more cards.
Ross Geller,That must be our alcohol and beers!
Ross Geller,"Ohh, it's Joey! I love Joey!"
Ross Geller,"I'll do it. Hey, whatever you need me to do, I'm your man. Whoa-oh-whoa! Are you, are you okay?"
Ross Geller,"Ohh, here's that Macadamia nut!"
Ross Geller,Nope! Something else.
Ross Geller,"I wanna get out of the room! Y'know, I...I really miss downstairs."
Ross Geller,Well hello! I'm Ross!
Ross Geller,"Excuse me sir, you've got a little something right here."
Ross Geller,Hello!
Ross Geller,"Well, hello, Mrs. Ross!"
Ross Geller,"Well, hello, Mrs. Ross!"
Ross Geller,Why are we in bed together?
Ross Geller,Yeah.
Ross Geller,"No! But we-we didn't have...sex-uh, did we? I mean, I don't remember much about last night, it was such a blur."
Ross Geller,And we didn't have sex.
Ross Geller,Tell me about it.
Ross Geller,Hey!
Ross Geller,What?
Ross Geller,Yeah!
Ross Geller,What?! Hello! We didn't get married.
Ross Geller,We-we-we-I remember being in a chapel.
Ross Geller,I-They would not let us get married when we were that drunk!
Ross Geller,"Laugh it up, but the joke's on you. Because we don't need to get divorced, okay? We we're just gonna get an annulment."
Ross Geller,What?
Ross Geller,"No-no, that's-that's not my thing! I do not love getting divorced!"
Ross Geller,Hey!
Ross Geller,"Yeah. Yeah, actually um, I wanted to talk to you about that whole annulment thing?"
Ross Geller,I'm not going to do that.
Ross Geller,"Yes, exactly!"
Ross Geller,"Wow! This is so amazing. I uh, I really thought I'd have to talk you into this more."
Ross Geller,"I'm-I'm not kidding. Look I-I, I can't have three failed marriages. I can't. Okay? I-I am not gonna be that guy!"
Ross Geller,"Okay, look, how is this gonna affect you? Really? I mean you fill some form out once and a while and instead of checking the box that says Ms you check the box that says Mrs.! It's right next to it!"
Ross Geller,I'm asking you to do me a favor.
Ross Geller,And as my wife I think you should grant me this favor.
Ross Geller,Hey!
Ross Geller,"Listen, I know you wanted to talk to me, but I have an idea that may make you want to stay married. We register, and you get to keep all the presents!"
Ross Geller,I don't know if it's true.
Ross Geller,"Oh, okay, y'know what this is? This is a difference of opinion. And when that happens in a marriage..."
Ross Geller,"All right. All right, I'll do it."
Ross Geller,Hey!
Ross Geller,"Oh, yeah, no problems. It's all taken care of."
Ross Geller,"Oh yeah, why not?"
Ross Geller,"Okay. You uh, you wanna hear something weird?"
Ross Geller,I didn't get the annulment.
Ross Geller,We're still married! Don't tell Rachel. See you later.
Ross Geller,Hey!
Ross Geller,"Oh, yeah, no problems. It's all taken care of."
Ross Geller,"Oh yeah, why not?"
Ross Geller,"Okay. You uh, you wanna hear something weird?"
Ross Geller,I didn't get the annulment.
Ross Geller,We're still married! Don't tell Rachel. See you later.
Ross Geller,"Hey, do you have any gum?"
Ross Geller,I know.
Ross Geller,"Well, I tried! But when I got to my lawyer's office all I could hear was, ""Three divorces. Three divorces!"" Look, I just don't want my tombstone to read, Ross Gellar, Three Divorces."
Ross Geller,"Look, all I know is I-I can't have another failed marriage!"
Ross Geller,"Well, okay so, I don't have it all worked out quite yet. Just don't say anything to Rachel, please?"
Ross Geller,Hey! Hi!
Ross Geller,What's up?
Ross Geller,"Oh my God. Ohh, my little sister and my best friend...shaking up. Oh, that's great. That's great."
Ross Geller,Bye.
Ross Geller,"Could ya just, could ya just lay off, please? All right? My life is an embarrassment! I should go live under somebody's stairs!"
Ross Geller,"No! No, I won't! I'll be at the bottom of the dating barrel now. The only guys below me will be Four Divorce Guy uh, Murderer Guy, and-and, Geologists."
Ross Geller,Oh yeah? Have you ever dated anyone who has been divorced three times?
Ross Geller,What?! Why?
Ross Geller,"And if you wait right here, I'll go get Ross."
Ross Geller,"...once you know the stories, it's not that bad. First marriage, wife's hidden sexuality, not my fault. Second marriage, said the wrong name at the altar, a little my fault. Third marriage, well they really shouldn't allow you to get married when you're that drunk and have writing all over your face, Nevada's fault."
Ross Geller,What?!
Ross Geller,"This is crazy! I mean, yes-yes Rachel is my good friend and I-I have loved her in the past, but now, she is just my wife! Phoebe, will you-will you help me out here?"
Ross Geller,"We were drunk! I would've married uh, Joey with that amount of alcohol!"
Ross Geller,"Look, I'm sorry, but you guys are wrong. I just don't want to be divorced three times."
Ross Geller,"Okay! Fine! Fine! If-if this is what you think, forget about the whole three divorce thing! Okay, I-I'll go to my lawyer's office right now and get this marriage annulled! Okay?! Because she means nothing to me! Noth--Nothing!!"
Ross Geller,Yes.
Ross Geller,"Yes, second in two years. Third overall."
Ross Geller,"Basically, Rachel and I were in Vegas and we got drunk..."
Ross Geller,"Yes-yes-yes! But, I-I do not love her."
Ross Geller,This was just a drunken mistake and I need to get it annulled.
Ross Geller,I think just the annulment for today.
Ross Geller,Easy.
Ross Geller,No problem.
Ross Geller,"Ooh! There's no way to do this without her? 'Cause I kinda all ready told her uh, it was, it was already taken care of."
Ross Geller,"Uh-ha, what about someone who looks like Rachel? I will think about the therapy."
Ross Geller,Oh no.
Ross Geller,I couldn't.
Ross Geller,It's not that. Okay? Annulments are more complicated than I...
Ross Geller,"I... I do, I do not love Rachel. I'm gonna tell her right now about the whole thing so we can get this marriage annulled as fast as possible. Okay? Would I do that if I loved her?"
Ross Geller,I do not have feelings for Rachel! Okay?!
Ross Geller,"Ohh, what's wrong?!"
Ross Geller,Oh my-Come here! Come here! It's okay. Everything's gonna be okay.
Ross Geller,Of course.
Ross Geller,Hey!
Ross Geller,"Oh, that. Umm, she took it really well."
Ross Geller,No.
Ross Geller,"I am not in love with her. She was very upset about having to move out so I eh, didn't tell her we were still married because she would only get more upset. I-I just comforted her, as a friend."
Ross Geller,"It's nothing, I just gave her a hug."
Ross Geller,It's also a sign of friendship.
Ross Geller,It was a hug!
Ross Geller,S-s-smell her hair? What if I did?
Ross Geller,"I was hugging her as a friend. It's not my fault her-her hair got in my face, she's got a lot of it and it smells all-all uh...coconutty. What?! Oh, that doesn't mean I have feelings for Rachel! Maybe it means I have feelings for coconuts!"
Ross Geller,"If the place you are referring too is being in love, then she is in the same place as me because I am not in that place!"
Ross Geller,Hey!
Ross Geller,"Rach, uh, you still looking for a place?"
Ross Geller,"Okay, there's this guy, Warren, from the museum and he's going on a dig for like two years and he's got this great place he needs to sublet. So uh, you interested?"
Ross Geller,"Don't thank me! If you wanna thank something, thank the volcano that erupted thousands of years ago, killing but perfectly preserving an entire civilization. Here's Warren's number."
Ross Geller,"Okay, you go grab it!"
Ross Geller,I don't know what you're talking about.
Ross Geller,"Look, I do not re-love her."
Ross Geller,"Look, we're just friends now! Okay? Why would I do anything stupid?"
Ross Geller,You can live with me.
Ross Geller,What?
Ross Geller,Uh-huh.
Ross Geller,"Well, I'm-I'm just glad I could, y'know, help you out."
Ross Geller,"Hero, I uh, I don't know-well, all right."
Ross Geller,"Oh please! You're gonna say things now, aren't ya?"
Ross Geller,"Hey! Oh listen, I was just clearing some space for your stuff."
Ross Geller,"What do you mean, they're not moving in? They-they're still moving in right?"
Ross Geller,What?! Over a stupid room!
Ross Geller,"Oh no, yeah no, that part's great!"
Ross Geller,"What's all this about you guys fighting?! Is this really over a room?! I mean, that is so silly!"
Ross Geller,"Well, apparently not, and I can't just stand by and watch two people I care about very much be hurt over something that is so silly. I mean, enough of the silliness!"
Ross Geller,"Okay-okay! Two very good points, look I've known you both a long time, and I've never seen either of you one/millionth as happy as you've been since you've got together. Do you really want to throw that all away over a room? That is so silly. Now wh-what is more important, love or silliness?"
Ross Geller,"Okay! All right! Now, Chandler you-you wanna live with Monica, right?"
Ross Geller,"And Mon, you wanna live with Chandler, don't ya?"
Ross Geller,Good! A verbal contract is binding in the state of New York!
Ross Geller,Hey Rach!
Ross Geller,"You're never gonna believe it uh, Monica and Chandler are moving in again. That's great news right-I mean for them. Right?"
Ross Geller,"Yeah but, on the bright side, we get to be roommates again."
Ross Geller,"Wh-why?! Why-why-why would it, why would it be weird?"
Ross Geller,No!
Ross Geller,"No! No! It would be weird if we were still in that place, I mean are you still in that place?"
Ross Geller,Good! Me neither! So it's not a problem. We're just two friends who happen to be roommates.
Ross Geller,Really?! We are?
Ross Geller,Ohh! That would be great.
Ross Geller,"Yeah, I didn't think of that."
Ross Geller,So are you sure about this whole moving in thing?! I mean it's a really big step! And-and what's the rush?!
Ross Geller,"No, I-I-I'm serious, okay? I mean, think about it. You move in, you start fighting over stupid game rooms, next thing y'know you break up!"
Ross Geller,"Okay, there are no stupid fights!! This isn't about the room, this is about what the room...represents! And unfortunately, this room could destroy you!!"
Ross Geller,"Fine! It's your life! I just don't want to see you guys break up! Which you will do if you move in together, but that's what you want, there's nothing I can do. DON'T DO IT!!!!!"
Ross Geller,"So umm, where are the other guys?"
Ross Geller,Fighting?!
Ross Geller,"Yeah. There's no breaking them up, is there?"
Ross Geller,Sure! Here.
Ross Geller,"Yeah, I'm-I'm sure. Yeah, get out of here before I change my mind."
Ross Geller,I've been back and forth.
Ross Geller,"Ehh, I don't, I don't think so. She's already talked about y'know, dating other guys."
Ross Geller,"Yeah, well, m-maybe you're right."
Ross Geller,Is that what I want?
Ross Geller,"Whoa! Whoa! Whoa, Joey!"
Ross Geller,"How weird is that? Y'know? You're moving in with me and have the one thing I don't have. It's like uh, in a way you-you complete me kitchen."
Ross Geller,"You complete me kitchen, matey!"
Ross Geller,What?
Ross Geller,Oh...my...God! I-I see what this is! You are in love with Rachel!
Ross Geller,"Of course! It all adds up! I mean you you're obsessed with her. It's always, ""Ross, what are you gonna do about Rachel?"" ""Ross, why-why are you moving in with Rachel?"" ""When are you gonna confess your secret marriage to Rachel?"" You want her!"
Ross Geller,"Uh-oh, saved by the bell. Hello?"
Ross Geller,"No-no-no, that's great! I'll be there Monday. And thank you again! Okay. Umm, that was the head of the Paleontology department at N uh, Y, uh U!"
Ross Geller,"Well remember that paper I had published last year on sediment flow rate, huh? They loved it."
Ross Geller,"I know! Anyway, they asked me to be a guest lecturer! I mean it's temporary, but uh, if they like me it could lead to a full time job. How great would that look great on a mailbox, huh? ""Professor Geller."""
Ross Geller,Hey everyone!
Ross Geller,"Hey uh, well, today's my first lecture and I kinda wanted to try it out on you guys, do you, do you mind?"
Ross Geller,"""There are three primary theories concerning sediment flow rate. Each of these theories can be further subcategorized into two distinct..."""
Ross Geller,"""...subcategories. The first of these subcategories is..."""
Ross Geller,No! Why?
Ross Geller,"Ohh! Okay! Okay. ""There are three primary theories concerning sediment flow rate. Each of these theories can be further subcategorized into..."""
Ross Geller,"Open with a joke? It's a university, not a comedy club!"
Ross Geller,Okay!
Ross Geller,Thank you!
Ross Geller,Please don't say naked chicks.
Ross Geller,I-I-I don't even know why I bother to talk to you guys about it. Y'know what? I'm just gonna do it on my own with no naked chicks.
Ross Geller,Hello!
Ross Geller,It went great! And I didn't need any jokes or naked chicks either!
Ross Geller,"I knew all I had to do was let the material speak for itself. Everyone's all, ""Ross you have to be funny and sexy."" Well, I proved them wrong! And now, I'm gonna pass the news onto Joey and Chandler."
Ross Geller,That's right!
Ross Geller,"Right! So when Rigby got his samples back from the laboratory he made a startling discovery! What he believed to be igneous, was in fact sedimentary. Imagine his consternation when- Oh bloody hell."
Ross Geller,"Look, I was nervous! You guys had me all worried I was going to be boring! I got up there and they were all like staring at me. I opened my mouth and this British accent just came out."
Ross Geller,Will you-will you please?
Ross Geller,Oh.
Ross Geller,"I'm sorry, I've got plans with my sister."
Ross Geller,"Right, will you excuse us for one moment? What are you doing?"
Ross Geller,Just please stop!
Ross Geller,"Look, I really need some help, okay? Why? Why did I have to speak in a British accent?! What do I do?"
Ross Geller,They're not listening too me?
Ross Geller,Monica you really think I should try this phasing out thing?
Ross Geller,"All right, keep going. We are phasing the accent out, phasing it out. So without out re-testing the results in the laboratory the team would never have identified the initial errors in their carbon dating analysis . Were there any questions at this point? Yes."
Ross Geller,"Come again? What's-what's this nonsense? All right, I'm-I'm not English. I'm from Long Island. I was really nervous and the accent just uh, just came out. I'm sorry. So, if we could just get back to the lecture. Umm, were there any questions? About paleontology. All right, look I was just trying to make a good first impression. Obviously, I screwed up. But what you guys think of me is really important because I'm-I'm hoping to get a permanent job here. So if you just give me another chance to make a good impression..."
Ross Geller,"Well, hello Rachel!"
Ross Geller,Look I was going to tell you!
Ross Geller,"Okay, maybe it wasn't my best decision. But I just couldn't face another failed marriage."
Ross Geller,"Rach, come on, if you think about it, it's actually kinda funny. Okay, maybe it's best not to think about it."
Ross Geller,"Phoebe, I told her you already knew."
Ross Geller,"Okay, I got us a court date for tomorrow at 2:00 and I picked up all the forms. I'll take care of everything."
Ross Geller,"Okay Rach, but..."
Ross Geller,Look I told you...
Ross Geller,"Look, if you'd had two failed marriages, you'd understand!"
Ross Geller,What about the time I said we were on a break?
Ross Geller,"Fine, I'm mentally unstable."
Ross Geller,What?!
Ross Geller,Crack isn't even an intravenous drug!
Ross Geller,"Oh, come on!"
Ross Geller,"Okay, I'm sorry, this is insane! I-I-I'm not addicted to heroin, I'm not gay, and there is no problem with my ability to consummate anything! Look, I'll consummate this marriage right here, right now!"
Ross Geller,And when we were dating we consummated like bunnies!
Ross Geller,"That's great! Are you happy now? Look what you did with your funny, funny form!"
Ross Geller,And what--What are you typing that for? Did you hear what she said? We don't get the annulment. Don't type that! What?! Stop typing! Hey! Stop typing! Stop typing! Stop typing!!
Ross Geller,Yeah!
Ross Geller,My fault?! You threatened the judge!
Ross Geller,That was the only way I could get him to stop typing!
Ross Geller,The judge wouldn't let us get an annulment! Now we gotta get a divorce!! Did a Porsch throw up on you?
Ross Geller,"I picked up the divorce papers. Uh, I've already signed everything and I put little 'X's where you need to sign."
Ross Geller,"Y'know, I-I-you've done a lot of stupid stuff too! Okay?"
Ross Geller,"Okay, how about you flew to London to stop my wedding! Ah, how about you told me you loved me after I was already married!"
Ross Geller,Yeah! Right!
Ross Geller,"You're right. That's very different. So let's, let's just sign the papers. All right? What?"
Ross Geller,"Okay, can we just sign please?"
Ross Geller,Congratulations.
Ross Geller,What?
Ross Geller,Excuse me?
Ross Geller,Yeah?
Ross Geller,"So then if-if-I mean if you think about it, this is all your fault."
Ross Geller,"I've got to say; I know I divorce a lot of women, never thought I would be divorcing you."
Ross Geller,"Did I, did I even treat?"
Ross Geller,That may be the most depressing thing I've heard in my life. I should probably get these to my lawyer's office.
Ross Geller,"Eh, no problem."
Ross Geller,Totally.
Ross Geller,Hey!
Ross Geller,"Whoa-whoa-whoa, Knicks season opener tonight. I thought maybe you guys would come over and watch it."
Ross Geller,I did give up a career in basketball to become a paleontologist!
Ross Geller,"Oh, but-but I can't do it."
Ross Geller,"Because, because I've got Ben."
Ross Geller,"Of course he is! What, do you think I'd just use my son as-as an excuse? What kind of father do you think I am?"
Ross Geller,I gotta go make a fake Ben.
Ross Geller,"Oh, I'm just over here with Ben. I thought we'd say hi."
Ross Geller,"Ben, say hi to Aunt Monica. Oh, I guess he doesn't feel like talking right now. He's smiling though! Okay, talk to you later."
Ross Geller,"Hello? Hey Mon, how's the packing going? Ben? He's fine. Yeah, he's right-Oh my God! Get your head of your shirt there son! What? Yeah, it's a pumpkin. I'll come pack."
Ross Geller,And now you want that money back.
Ross Geller,"Chandler, what kind of an idiot do you take me for?"
Ross Geller,"I'm sorry you lost your money, but I won it fair and square."
Ross Geller,"Now, if you wanna try to make some of it back, I'd be glad to play you for it. But I should warn you, I am very good at Cups."
Ross Geller,No.
Ross Geller,"So, I just finished this fascinating book. By the year 2030, there'll be computers that can carry out the same amount of functions as an actual human brain. So theoretically you could download your thoughts and memories into this computer and-and-and live forever as a machine."
Ross Geller,Hi!
Ross Geller,"So uh, wha-uh, what do you do?"
Ross Geller,Thank you for bringing her into our lives.
Ross Geller,"Yeah, yeah man don't do it. I mean if you date her, then-then-then I can't date her."
Ross Geller,"Monica had such a crush on him. Yeah, she used to kiss his poster every night before she went to bed."
Ross Geller,Yeah.
Ross Geller,Hey!
Ross Geller,"Wow, couples who live together do start to look alike. So, Mondler...uh, what uh, what 'cha doin?"
Ross Geller,Did you get Monica's authorization to move all of her stuff?
Ross Geller,Put it back exactly where you found it?
Ross Geller,"'Kay, first of all, this attitude is not helping."
Ross Geller,"Whoa, hello, did you just meet Monica?"
Ross Geller,"Hmm -you know, actually this'll work out well. Cause when you have to move back in with Joey, Joey's hot new roommate can come and live with me."
Ross Geller,"Look Chandler, Monica is really weird about this kind stuff all right. Believe me, I lived with her for 16 years. She is going to freak...out. Oh my God, she's going to sit on you."
Ross Geller,"Yeah, the phone was facing the other way. And that goes back up there."
Ross Geller,"Yeah that-that, doesn't look right."
Ross Geller,"Whoa, whoa, but then the back of the couch won't line up with he back of the carpet."
Ross Geller,"Whoa, Whoa, Whoa, but then the coffee table won't be centered in the seating area."
Ross Geller,"Hey, I've been married 3 times"
Ross Geller,"Look, we do not repel women OK? That is completely untrue."
Ross Geller,"Yeah, well what about you? You weren't you know, so hot in college either. After everything he said, he'd go ""ba dum bum chessh"""
Ross Geller,"Oh y'know what, girls don't like it when I start talking about science."
Ross Geller,"Uh, they don't like it when you correct their grammar."
Ross Geller,They don't like it when you keep asking them if they like you.
Ross Geller,I'm never gonna find love again.
Ross Geller,Who cares? I repel women.
Ross Geller,What?!
Ross Geller,Why does anyone have to be naked?
Ross Geller,I-I had to show Chandler something?
Ross Geller,"Yeah-yeah I uh, I have a uh, a guy problem."
Ross Geller,"Dude, what'd you have?"
Ross Geller,The photo album! There were millions of pictures of the apartment in the photo album. We just go through it and match everything to the pictures.
Ross Geller,"So really, what'd ya have?"
Ross Geller,Bye!
Ross Geller,"So it said that by the year 2030, there'll be computers that can carry out the same number of functions as an actual human brain. So theoretically we could download our thoughts and our memories into this computer..."
